id,Description,StockCode,UnitPrice,ProfitMargin,DiscountedPrice,DiscountPct
EHEH8SJuWNf5tWQRhAC9LS,PING! MICROWAVE PLATE,22108,3.36,2.91,3.09,0.08
dAFQF4UadmpjcEaw8ubyvK,CAKE STAND LOVEBIRD 2 TIER PINK,22221,20.38,11.07,12.23,0.4
VHJhQ7ZUBMPnJB9V2dubej,CAKE PLATE LOVEBIRD PINK,22223,10.17,6.24,9.25,0.09
MCxosWXfEhRdzki8cze9GJ,12 EGG HOUSE PAINTED WOOD,22282,25.49,19.82,21.92,0.14
CPbCxEXpZamECPCLD3bQSn,ROUND CONTAINER SET OF 5 RETROSPOT,22329,3.36,2.63,2.92,0.13
HzQKRyABkExXRELYHxKaDM,SET OF 36 DOILIES SPACEBOY DESIGN,22416,2.98,1.53,2.5,0.16
T45sU3EkCoEi73gPcuXckG,PACK OF 20 SPACEBOY NAPKINS,22613,1.66,0.2,1.63,0.02
4Q3FuCH5VraPhjchVcA6Jk,VINTAGE BEAD PINK PURSE,35648,5.91,5.07,5.08,0.14
Bam7Mmt4ps7SBvKe9r9u2F,VINTAGE BEAD PINK SCARF,35651,16.13,6.98,9.52,0.41
Q32kY8KXqnnJaFLrvMp42g,CERAMIC CAKE DESIGN SPOTTED PLATE,37447,3.36,0.31,0.44,0.87
EP6cLr53FQ32Hsr7nqZYo8,FUNKY MONKEY CUSHION COVER,46118,8.47,0.62,3.9,0.54
HPyBw9aHC2rfp3ANS7ZjPw,WOVEN FROST CUSHION COVER,46776C,4.21,2.02,3.16,0.25
Xx3cFceq3fpVEw6BWpEeZ5,WOVEN CANDY CUSHION COVER,46776E,4.21,3.79,3.96,0.06
FqC6f3fK7SpopnN8EpHVYy,TURQ ICE CREAM BUM BAG,62094B,5.06,4.08,4.76,0.06
2gpTKiDpzHWWrYv2rV3JUy,SET/4 WHITE RETRO STORAGE CUBES,84078A,76.55,69.36,69.66,0.09
a5ApTZtDDXAapRuEtZrkJN,HEN HOUSE W CHICK STANDING,84228,0.84,0.16,0.41,0.51
BcNWUpiGiRYRjfAtq9MpqZ,GIRLS ALPHABET IRON ON PATCHES,84568,0.43,0.31,0.38,0.11
DaEwAyVxch7KVadD3XuYKQ,ENCHANTED BIRD PLANT CAGE,84789,7.62,3.21,4.42,0.42
huKsMh6B8b8DWjZ6oyj59F,SET OF 4 DIAMOND NAPKIN RINGS,84813,25.49,18.49,21.16,0.17
H7RYSa9P6A64g4WsbBTKDz,CANDY SPOT EGG WARMER HARE,85093,2.51,1.9,1.96,0.22
ZRwZQWXCk5j73UECHDqWFH,HILDA CANDY SPOT RABBIT,85096,7.62,5.06,6.48,0.15
AWnYdN2yyFpcxzz5dS2qB7,HANGING WOOD AND FELT HEART,85202,0.84,0.43,0.69,0.18
WVpMoLg5UtNqfUfQ5i5Haw,HANGING WOOD AND FELT FLOWER,85204,0.84,0.55,0.71,0.16
X2WJkgkHB6upNGQN8NCqLa,ANTIQUE OLIVE GREEN FLOWER EARRINGS,90001D,4.24,1.54,3.69,0.13
UnDSVirtSwEepPxsckbN7G,GREEN VINTAGE EARRINGS,90013C,4.24,1.55,1.78,0.58
E6NcBwM7zproYrpvUqFDBx,GOLD M PEARL  ORBIT NECKLACE,90014B,10.62,6.05,6.9,0.35
RycYmUZjmVTJ5jQ4xqPwhH,CRYSTAL STILETTO PHONE CHARM,90085,1.66,0.34,1.61,0.03
FhKNMiRjYtvwAqoqpxhfYv,LIGHT TOPAZ TEAL/AQUA COL NECKLACE,90132,5.09,3.31,4.58,0.1
TFt4ihDtaJDCdSawJNnomU,PINK SWEETIE NECKLACE,90140,7.64,6.17,7.18,0.06
ds9qwuACNyPYeKy8QD926f,IVORY PENDANT TRIPLE SHELL NECKLACE,90141B,5.09,4.64,4.94,0.03
MLTXxt8Kr72UAcCT9gjLpw,ST TROPEZ NECKLACE,90158,5.09,1.89,3.31,0.35
2tH2yWSCvSUQyWKhe6PTs4,AMBER DROP EARRINGS W LONG BEADS,90183A,2.96,2.04,2.13,0.28
cGhHtX2aKa6LPwvTPr949v,AMETHYST DROP EARRINGS W LONG BEADS,90183B,2.96,0.06,1.45,0.51
eJT3AQHs4nTECRBvZJvJkA,BLACK ENAMEL FLOWER RING,90201B,2.96,1.23,2.72,0.08
HeNFyuYjrkQrGmhrTQxLZB,JET BLACK LAS VEGAS BRACELET ROUND,90212B,3.81,0.72,1.07,0.72
UkTQvdrXyP8LiARmyaVgh7,PINK JEWELLED PHOTO FRAME,84712B,7.95,1.06,3.18,0.6
epKs7TPmArF4DTc2um8SwB,POCKET BAG BLUE PAISLEY RED SPOT,22279,1.25,0.82,1.2,0.04
CAtqKpyKBhJnQJY3L3Uq5g,POCKET BAG PINK PAISELY BROWN SPOT,22280,1.25,0.73,1.05,0.16
KCjvAR3orpengCiwSBYEDX,BOTTLE BAG RETROSPOT,22377,4.21,0.93,4.08,0.03
kUc45tpgvEyKXtLnfCjvLL,SET OF 2 ROUND TINS CAMEMBERT,22495,5.91,1.05,3.19,0.46
35rSihgD624fh5jPeh2ZRy,CHILDS GARDEN TROWEL PINK,22521,1.66,1.59,1.63,0.02
SKYPvvsfRcYserXHqvYx5k,CHILDS GARDEN FORK PINK,22523,1.66,0.08,0.51,0.69
LXxJnvSVnaXaLMyYFpTSqC,FRENCH BLUE METAL DOOR SIGN 2,22677,2.51,0.84,2.06,0.18
KBaBdrLYAwLL32zZDRhxkW,FRENCH BLUE METAL DOOR SIGN 7,22682,2.51,0.89,1.43,0.43
NfCMMckkrKMhv7Nv3eRSPN,CARD WEDDING DAY,22715,0.85,0.62,0.64,0.25
79Aa6DEdDTUxmonTWhhP9z,SET OF PICTURE FRAME  STICKERS,21253,5.91,3.11,3.19,0.46
ScAF9jtwFdHUkFKTnNyMgW,PINK GOOSE FEATHER TREE 60CM,21265,5.91,2.3,3.49,0.41
kZyGEad4TtHQuMFhkPYMSV,IVORY HANGING DECORATION  BIRD,21389,1.66,1.47,1.56,0.06
kLjJHfSM3h5Jqnm3U4eybD,FRENCH LAVENDER SCENT HEART,21391,4.21,3.5,3.79,0.1
fDD4oaLTiF3YiBZWK4deUr,BLUE EGG  SPOON,21403,0.85,0.76,0.83,0.02
TJvdhjnN6BcxFzeMw6ZZzW,DAIRY MAID LARGE MILK JUG,21534,10.17,6.85,9.66,0.05
3HNVabnUGhJdVBgxoKZGQv,4 WILDFLOWER BOTANICAL CANDLES,21618,7.62,3.4,5.18,0.32
m78kiworKNqrJDKWetwkTX,GARLAND WITH HEARTS AND BELLS,21812,10.17,4.67,8.64,0.15
iFaFgCJmKkHBJQHBKqb3Vr,GREEN  DIAMANTE PEN IN GIFT BOX,21847,4.21,0.57,1.09,0.74
MQJsewxYxSE98darVT8JN2,CAKES AND RABBITS DESIGN FLANNEL,21943,1.66,1.43,1.48,0.11
XEiRZLUD5dQfb6pXkfwSTK,MIRROR MOSAIC CANDLE PLATE,22104,1.66,0.9,1.26,0.24
maMMfwd69pmU5GJwmiH5Zm,BIRD DECORATION GREEN POLKADOT,22322,1.66,0.63,0.8,0.52
bSNnm2JaWnX4QxBfq2BAUN,NOEL GARLAND PAINTED ZINC,22340,3.36,0.57,1.31,0.61
VWGHDtSkYZVPEoPSnB4Pwx,4 GOLD FLOCK CHRISTMAS BALLS,35833G,3.36,2.23,3.23,0.04
Bi4mBBPfuQXA6Kb7rSBPRh,YELLOW FELT HANGING HEART W FLOWER,35916A,1.66,1.16,1.24,0.25
NZWzN3k8evWJmawFwB2WeK,WOVEN BUBBLE GUM CUSHION COVER,46776A,4.21,3.26,3.37,0.2
T64P7ZbaEpfFtnG8FCoyHg,SET/6 PINK  BUTTERFLY T-LIGHTS,72351B,4.21,2.38,2.86,0.32
NJuvtczKUzutCPqWu8JRgQ,PINK METAL CHICKEN HEART,84459A,3.36,2.51,2.76,0.18
JvRXjBUGxAGJuZNmFSRKmN,KITCHEN FLOWER POTS WALL PLAQUE,84637,12.72,2.83,5.22,0.59
8PKB3roeaVzdNEwcNcDxDS,S/4 IVORY MINI ROSE CANDLE IN BOWL,85039B,1.66,1.62,1.63,0.02
8zkqMATKCWcZNZ5dTkdCNr,S/4 BLACK MINI ROSE CANDLE IN BOWL,85039C,1.66,0.87,1.23,0.26
BPkWoUqnxuByGAdssNVVLq,BEADED CRYSTAL HEART BLUE ON STICK,85131C,0.85,0.39,0.52,0.39
Qsb9CoQdyq4SeYUSrB44F2,AMBER GLASS/SILVER BRACELET,90010E,9.34,4.52,6.54,0.3
XmNV8hk9jCSG8kJmNDCLzq,FIRE POLISHED GLASS BRACELET BLACK,90039C,3.81,3.37,3.66,0.04
EzAZWBtT2tL6UJZtDVTLXw,CHUNKY CRACKED GLAZE NECKLACE IVORY,90056,11.05,5.46,8.51,0.23
3RThZWGCE9UwzytQdqQkJv,LILY BROOCH OLIVE COLOUR,90081C,5.09,2.34,3.97,0.22
gKeo33xYgXQK4qrddpsPmW,WHITE FRANGIPANI NECKLACE,90101,2.54,1.28,2.41,0.05
cXx8bM7goCLDqrE9qKu8Pq,TURQ STONE/CRYSTAL EARRINGS,90130B,2.96,0.94,2.07,0.3
3EeQcEJ49rFa2MkKxpDcBw,GREEN STONE/CRYSTAL EARRINGS,90130C,2.96,0.87,2.9,0.02
JCD2dSZbbKGTW4LhVFiFLy,PURPLE PAPER PARASOL,15044C,5.91,3.55,5.56,0.06
5B397TA2NzeGJoS5pXzARv,GREEN FERN SKETCHBOOK,20762,7.62,5.24,7.24,0.05
LCy4m5xQgYLvYtiYmHFMmr,SMALL PINK GLASS SUNDAE DISH,20803,3.36,0.36,2.59,0.23
YDZ3KpBQLNwjMw2hCwYDrM,ESSENTIAL BALM 3.5g TIN IN ENVELOPE,18007,0.18,0.17,0.17,0.04
QVM8r43fCKNqhSTNY4o3BG,CAKE SHOP  STICKER SHEET,21720,0.85,0.38,0.6,0.29
JqQ2te5H8VcKz4Eo4nd9Jw,SET OF 16 VINTAGE SKY BLUE CUTLERY,84968F,12.75,7.38,7.91,0.38
NpCXuyEvpbBZVpPqCmss34,LARGE STRIPES CHOCOLATE GIFT BAG,21289,1.25,0.7,1.06,0.15
NcvAk7gPoJvDTJeRJZr37i,WOODEN SKITTLES GARDEN SET,22606,15.95,1.61,10.37,0.35
5pCe3Qkx3mungtSKT32y3e,CUBIC MUG FLOCK BLUE ON BROWN,37479B,2.55,0.17,2.32,0.09
cGH69w5pLBHGRZAbpM8cQ8,CUBIC MUG PINK POLKADOT,37482P,2.55,0.89,1.2,0.53
Kahkt9mhfYeLqsZbEsL5Ag,VINTAGE KEEPSAKE BOX TRAVELOGUE,20903,6.35,3.12,3.68,0.42
XENN32gcTWD3w8qy9cAafb,VINTAGE NOTEBOOK PARIS DAYS,20897,2.95,2.91,2.89,0.02
URJSaoWqkVZXHeax5YSv6k,"PINK/WHITE ""KEEP CLEAN"" BULLET BIN",71403,2.95,0.23,1.45,0.51
GdbBtuNhR9iuZn87D9Fr6D,FRENCH BLUE METAL DOOR SIGN 8,22683,1.25,0.06,0.86,0.31
6BoQg8bSCfMMFJmB4BNrN2,FRENCH BLUE METAL DOOR SIGN 0,22685,1.25,0.14,0.85,0.32
UN4NTTEkGkunKTxrUt3xpK,SET OF 36 MUSHROOM PAPER DOILIES,21973,1.45,0.78,1.33,0.08
6hpZtbsiAjiGHZE9wfdCXX,DOORMAT WELCOME SUNRISE,22691,7.95,0.42,1.27,0.84
aNbkeTFQi4gWCNGSFFrR9W,TOXIC AREA  DOOR HANGER,21162,1.45,0.12,1.2,0.17
UJhFokZ89Z8vuP6o4fqsEr,LA PALMIERA TILE COASTER,84926D,1.25,0.15,0.19,0.85
nPtpZQwAjsTJFpRD3zfDaX,JIGSAW RABBIT AND BIRDHOUSE,22233,1.65,0.42,1.06,0.36
Jo6PgVotzX6FUDdrXTfsv5,WOODEN BOX ADVENT CALENDAR,35400,8.95,0.82,1.16,0.87
GTHEn9jnrrALehC677EWD7,PLASMATRONIC LAMP,22486,12.75,7.77,9.05,0.29
6Q3bT7enNmBNN5UzAoDpRZ,4 BURGUNDY WINE DINNER CANDLES,72801G,1.25,0.91,1.0,0.2
Qu2BkkuL6AwgcpbxP7XGtk,SILVER OVAL SHAPE TRINKET BOX,84711A,9.95,4.75,6.77,0.32
Nrosm2FBN2HJQmTnbDDTdK,WRAP BLUE RUSSIAN FOLKART,16169N,0.42,0.09,0.4,0.05
2GPrn6sWjbGP4v5sALCBd8,DAISY JOURNAL,20769,2.55,0.37,1.63,0.36
Q4ifrtfJMs5edDGUud7knp,DUSTY PINK CHRISTMAS TREE 30CM,35597A,1.25,0.88,1.0,0.2
LA8BpE3qcpzuggg6zsPriG,HANGING PHOTO CLIP ROPE LADDER,47480,1.65,1.53,1.58,0.04
EQ2bh4UAEhXufPEwkYnRFV,PINK PARTY SUNGLASSES,84522,1.95,1.42,1.56,0.2
P5SuRmuRXHkiouhf3rmBcM,POSY CANDY BAG,20731,1.25,1.07,1.2,0.04
GWi7pwfD9ooUuUFzCGzNFT,BLACKCHRISTMAS TREE 30CM,35597B,1.25,0.21,0.96,0.23
A9MgHvaLPBVCU8ruTa5Uz5,SMALL DOLLY MIX DESIGN ORANGE BOWL,84596B,1.25,0.43,1.01,0.19
EG3Gxuv29bTtEDCwwACdST,POCKET MIRROR WOODLAND,21226,1.25,0.06,0.49,0.61
WrcPT7r8KoJe2Uiazjomde,HEART SHAPE WIRELESS DOORBELL,79160,2.1,1.89,1.91,0.09
Tsa5zGQMLjFQ3ujD8fpfC9,COLUMBIAN CANDLE RECTANGLE,72131,1.95,1.5,1.74,0.11
geTUZPGRjGbhRYt5gRpYNk,SET/6 GREEN SPRING PAPER CUPS,21089,0.65,0.23,0.38,0.42
TrkzFgwuSBkHBphLBFJXEE,ASSORTED TUTTI FRUTTI LARGE PURSE,21647,2.1,1.61,1.78,0.15
UHmaq2hyLVxW7eJYNbfLDm,COFFEE SCENT PILLAR CANDLE,72122,0.95,0.88,0.88,0.07
69mrgurdjyZ7BZpATBQWuz,PINK ROSE WASHBAG,84912A,3.75,0.82,1.24,0.67
JRAKia3CJVTdaiMhPhF3HK,GARDENIA 1 WICK MORRIS BOXED CANDLE,85036A,4.25,4.16,4.17,0.02
6jfjLqbv37WHYQDnEDuF2N,SILVER LATTICE VANILLA CANDLE POT,21692,3.75,3.68,3.67,0.02
Fo67GuX3c9V779nmsR7dxV,PACK 3 IRON ON DOG PATCHES,84569A,1.25,0.65,0.9,0.28
4LeDtKBhSqp2ef7Ebazi5r,DAISY NOTEBOOK,20775,1.65,0.9,1.5,0.09
Hishr8VXb922FCNW44WLt4,BLACK FINE BEAD NECKLACE W TASSEL,90179C,5.95,1.88,3.51,0.41
3V92SC25qooHodCpkTTqPK,FIRE POLISHED GLASS NECKL BRONZE,90060D,5.95,5.54,5.77,0.03
NQ4Art5PZBK3M2T6iANvGs,ROUND PINK HEART MIRROR,85020,2.1,1.22,1.68,0.2
m8mPrQdnMoNACV4apPezTa,GOLD COSMETIC BAG PINK STAR,20861,2.1,1.86,2.04,0.03
Djm26cA4HxZLeDewqyAkkY,EIGHT PIECE CREEPY CRAWLIE SET,21827,1.25,0.08,0.73,0.42
bsZMJnqENPUetMiGQ9eS4i,SMOKEY GREY COLOUR D.O.F. GLASS,79051A,0.65,0.25,0.57,0.13
44zrQXni3UbuopRm9pMs2x,S/3 POT POURI CUSHIONS BLUE COLOURS,17007B,2.1,0.41,1.16,0.45
a995tcgFXsrWb3Xm2jcg6g,BLACK AND WHITE DOG BOWL,22700,2.95,0.43,0.62,0.79
bTqboLEfLUbpVFjMmeGCZa,SPOTS ON RED BOOKCOVER TAPE,10124A,0.42,0.07,0.34,0.19
d97ZCwyEsqPCFV5SyLrWAJ,ASSORTED TUTTI FRUTTI HEART BOX,21644,1.25,0.93,1.09,0.13
4MBVg783soguisxAPfLjXu,POLYESTER FILLER PAD 65CMx65CM,46000P,4.25,4.06,4.17,0.02
ZRRnkA9eZ4ShnAtFEnL9tt,FRENCH BLUE METAL DOOR SIGN 6,22681,1.25,0.81,0.86,0.31
Yry8d5fmx2VFFtYdY5nyN2,SMALL RED RETROSPOT WINDMILL,21746,1.25,0.58,1.21,0.03
ispE7pVk2FcR42WxQigahv,HAND TOWEL PALE BLUE W FLOWERS,84916,5.95,0.55,3.75,0.37
VCoypWLLoEkFHyaMx49v62,BLUE ORGANDY ROUND LAMPSHADE W BEA,40005B,0.85,0.08,0.63,0.26
C33WxMTZEM4nBhMbMp7cci,WHITE AND BLUE CERAMIC OIL BURNER,18094C,1.25,0.94,1.19,0.05
UzyexaFp5vVXrRtf6ucFRD,PAPER CHAIN KIT SKULLS,22085,2.95,1.76,2.54,0.14
jSg6BodMZi876q9tDmwnQn,PINK FAIRY CAKE CUSHION COVER,47586A,2.55,1.91,2.04,0.2
j2tpMdvpRSjU7UNiqU4coA,GREEN POP ART MAO CUSHION COVER,46115B,0.19,0.17,0.18,0.06
TUCr6j558wSJ8ddRNRZfNd,HEART SHAPED MIRROR,84975,1.69,1.02,1.22,0.28
kpxCqaoUnW9n3i59harPjS,GOLD WASHBAG,21336,2.95,1.88,2.45,0.17
mFfW2vBYhEKGoWoEE8yjFE,PINK PAISLEY ROSE GIFT WRAP,22050,0.42,0.36,0.39,0.06
nPqGSdT2pWp2iayDdxJxg8,WOODLAND  STICKERS,21680,0.85,0.23,0.74,0.13
9gpQExDLXKxZP2TBsCcmm6,SILVER TEDDY BEAR,20819,3.75,2.31,3.56,0.05
gUoN6parRpoAmzhQFYrXEL,PSYCHEDELIC WALL THERMOMETER,84925F,2.55,1.86,2.04,0.2
7FxDqGnWMJgo6GhyL7jvGV,MAGIC DRAWING SLATE BUNNIES,22535,0.42,0.08,0.15,0.65
4rFFZ6vyw25v2Bb2LT2a4U,WRAP FOLK ART,16169K,0.42,0.23,0.34,0.19
TmUNvEEP8LYEiVbBfJi2bV,ROSE DU SUD WASHBAG,21001,4.21,2.59,2.9,0.31
MXCpgkCXYxiRVVXyhnERDc,NINJA RABBIT BLACK,21028,2.51,1.56,1.96,0.22
nQ82iX5fGFp6kW78XXuqf6,BATHROOM METAL SIGN,21171,3.36,3.36,3.33,0.01
4ZRYw6cN9BYZCrFANWG8p3,DAISIES  HONEYCOMB GARLAND,21204,3.36,2.61,2.69,0.2
QNzFTA5qtYjckoBXmEBgjn,SET/4 BADGES BEETLES,21222,2.51,0.58,1.96,0.22
S2c5pLGwKSq2H4KUotxtXA,DINOSAUR HEIGHT CHART STICKER SET,21251,5.91,1.91,2.66,0.55
DJkQyNmLaDaEXnbGXH9YzM,LARGE CAMPHOR WOOD FIELD MUSHROOM,21375,11.02,7.34,8.04,0.27
SU2dnXGzbebozTiskqeyEX,Dad's Cab Electronic Meter,21595,8.47,4.04,5.59,0.34
LxTCQZZpPpzya6AmNRpNTB,MIRROR MOSAIC VOTIVE HOLDER,22101,2.51,2.05,2.06,0.18
AmQEXcJvkyj5uvDyB9nPgE,PINK CHICK EGG WARMER + EGG CUP,35914,4.21,3.22,3.66,0.13
SWKJ2PUeTRmAZsF6wcoD8K,"PET MUG, GOLDFISH",37462E,0.84,0.7,0.75,0.11
dU34uo2A2y9unFYHbLtbj3,SET/4 2 TONE EGG SHAPE MIXING BOWLS,37474,9.95,2.23,6.87,0.31
npnvE8hZRWv9JcYoUsM49x,50CM METAL STRING WITH  7 CLIPS,47481,2.13,0.67,2.02,0.05
aq3t3Ziyen6VTixV5cTnK4,BLUE TV TRAY TABLE,84313B,16.98,12.04,16.64,0.02
erW4bpHh9edZj6zAfr6QxY,PINK/BLUE DISC/MIRROR STRING,84422,1.66,0.32,0.53,0.68
YGP6P5U6nZJYrbB5L4JXVS,MEDIUM PINK BUDDHA HEAD,84429A,5.91,4.89,5.32,0.1
B5y7KDTP7PeQWtfUgPReYi,SET OF 4 POLKADOT PLACEMATS,84509C,7.62,5.15,5.87,0.23
8mWV3eyN2hztzsGNK8SqUT,SET OF 4 POLKADOT COASTERS,84510C,2.51,1.13,1.91,0.24
SqeF2PkT5UCUKNVPcJZT5i,WHITE HAND TOWEL WITH BUTTERFLY,84917,4.21,1.01,3.75,0.11
gHgPD3JqbvyAZDQHTdrqkz,CANDY SPOT CUSHION COVER,85087,8.47,5.88,6.01,0.29
94obCZdQyYmCJYPChKB5WR,CANDY SPOT EGG WARMER RABBIT,85094,2.51,2.11,2.43,0.03
AmH3f7t8gDf6QS6WLhh4Gk,SMALL ROUND CUT GLASS CANDLESTICK,85125,10.17,5.06,9.15,0.1
3nsUcY74A5Z8tDnRYSz82A,MIDNIGHT BLUE VINTAGE EARRINGS,90013A,3.81,2.71,2.74,0.28
YMuA6M9tkG5TupAndoXZch,DIAMANTE HAIR GRIP PACK/2 CRYSTAL,90059A,1.69,1.5,1.64,0.03
fRb8mchv72rnx8CpMhHdLQ,VINTAGE ENAMEL & CRYSTAL EARRINGS,90073,5.09,1.66,2.44,0.52
Fs7aLixWxDv7QayVr9L7tT,BLACK DIAMOND CLUSTER NECKLACE,90074,9.77,0.86,7.43,0.24
Ra67GWxP4JnRKjmKKMhvKo,PURPLE FRANGIPANI HAIRCLIP,90104,0.83,0.52,0.64,0.23
kaAJ6JXgmytYMc7k8EtMZH,GREEN GLASS TASSLE BAG CHARM,90129C,1.66,1.51,1.53,0.08
FMBTTF5LhAMLhQTezrLrGs,AMBER GLASS TASSLE BAG CHARM,90129D,1.66,1.42,1.51,0.09
kAFyuktsQy8dADVkLodEAx,PURPLE GLASS TASSLE BAG CHARM,90129E,1.66,0.18,1.01,0.39
TekWzVrvYrXZGJs969jnxJ,TURQ+RED BOUDICCA LARGE BRACELET,90160C,7.22,0.67,4.04,0.44
DYQgFzUXF5GR4ATTyVjtGd,ANT COPPER PINK BOUDICCA BRACELET,90161D,5.09,0.11,4.12,0.19
VDQ3ViVEYpwbPbaFKeBG4X,PINK GLASS CHUNKY CHARM BRACELET,90175B,9.34,7.59,8.87,0.05
ASXarZy9md8smarh7Eepx9,DROP DIAMANTE EARRINGS PURPLE,90177D,2.96,2.88,2.9,0.02
mhFFdLE4R4exxWPWCaAaAP,BLACK CHUNKY BEAD BRACELET W STRAP,90184C,9.34,6.7,8.03,0.14
h5ZmAGC68AckdGokcmgTXN,AMBER DIAMANTE EXPANDABLE RING,90185A,4.24,2.37,3.14,0.26
gcboNN2m3phS555YEphJMe,PAIR OF PINK FLOWER CLUSTER SLIDE,90208,2.54,1.04,2.44,0.04
j5VNn5uSK6pNjLtaoAXNtP,RED PAPER PARASOL,15044D,5.91,3.99,4.73,0.2
4eWnsQQkQMap9gDpiNw3wj,SILVER JEWELLED MIRROR TRINKET TRAY,84707A,9.95,5.16,9.45,0.05
VkJcQQ4nDWQmmEcehAhcvb,4 LILY  BOTANICAL DINNER CANDLES,21617,3.75,1.96,2.85,0.24
gY394gpMQcABv6Kv3kZEQJ,GROW A FLYTRAP OR SUNFLOWER IN TIN,22693,1.25,1.16,1.21,0.03
6EEdtocMJ75ssNaiX4Ku79,VINTAGE BEAD PINK EVENING BAG,35646,4.25,3.04,3.1,0.27
HbKwNWndG3MuzsoaU6z4kV,ENGLISH ROSE SCENTED HANGING FLOWER,47574A,4.25,1.99,2.21,0.48
Z6dcHTFcrBYYm5ovyPwpME,CUPID DESIGN SCENTED CANDLES,72819,2.55,0.05,2.27,0.11
EDs3P9tDgHUZVdySQvyAsB,SQUARE CHERRY BLOSSOM CABINET,84665,5.95,0.16,2.8,0.53
kyVpG5UTqDdLWUbzQGxWcQ,BLUE ROSE PATCH PURSE PINK BUTTERFL,20857,1.65,0.72,0.84,0.49
dK2SqxdQGKg9mNtxiiRLW9,WHITE BEADED GARLAND STRING 20LIGHT,85047,6.35,2.18,5.46,0.14
Qb5xNSk3QvCrK2pA9ANxVF,WOODEN REGATTA BUNTING,22498,5.95,2.24,4.46,0.25
Rc8WSKdXdh2rmtpr78h2qF,FREESTYLE CANVAS ART PICTURE,84725,4.25,2.03,3.99,0.06
Y3bzVBsC8SpLsKrUM4LUek,CUBIC MUG FLOCK PINK ON BROWN,37479P,2.55,0.77,2.01,0.21
5bPAaCHQavvrz4sZF3p6jd,PORCELAIN BUDAH INCENSE HOLDER,17038,0.07,0.03,0.05,0.22
JABWhZhsadPFRBRVT3QuRP,WISE MAN STAR SHAPE EGG PAN,84388,1.65,1.19,1.42,0.14
MMDZa389rLf5ru9g6PYSp7,LOVE POTION MASALA INCENSE,17084J,0.21,0.06,0.14,0.31
NMeK5qJSvdEuERaozVH6mh,SET OF 16 VINTAGE RED CUTLERY,84968D,12.75,10.07,10.96,0.14
XtTBvKfrV6WSEdePYW7idC,WOOD STAMP SET FLOWERS,22211,1.65,1.07,1.37,0.17
QtAjaxMoqX9srwc2thtHmV,CALENDAR FAMILY FAVOURITES,22903,2.95,0.75,2.54,0.14
4dd85fXYafRr6p8a6mLhRn,BANQUET BIRTHDAY  CARD,22026,0.42,0.09,0.32,0.23
Aq3UaaXTdSMTc3fZHBBVdP,MULTICOLOUR SPRING FLOWER MUG,37340,0.85,0.81,0.82,0.04
fX3yK6iQp5J3XgViDfGfZe,TEATIME PUSH DOWN RUBBER,16052,0.84,0.37,0.69,0.18
8hKkwUcp9vcn9GGAYKtqhF,HOUSE SHAPE PENCIL SHARPENER,16219,1.7,1.13,1.48,0.13
FvTC77xhTrfuMMAVcKY2Ej,DAISY SKETCHBOOK,20763,7.62,6.25,6.78,0.11
KkkEQEvE54W83wuWuxw4Fi,LARGE PINK GLASS SUNDAE DISH,20801,5.06,0.55,2.33,0.54
k3kcgdDtJHq4jpboRy8bvB,SET/3 TALL GLASS CANDLE HOLDER PINK,20892,25.49,20.86,23.2,0.09
XEfQ2jiXhc9EY6e5hFNJfE,SMALL CHUNKY GLASS ROMAN  BOWL,21316,5.91,2.55,2.54,0.57
8pyV94DQH3NKkLFhzDmu3L,RIDGED GLASS T-LIGHT HOLDER,21666,1.66,0.62,1.58,0.05
XyeYNEvG4kDZwH7wfs3KFk,HANGING CHICK GREEN DECORATION,22293,2.98,1.85,2.03,0.32
GQmRhESf8mkqmnJkoRmVqk,PENS ASSORTED FUNKY JEWELED,22608,1.66,0.65,1.56,0.06
mnmaYgxM7hynzQdxoUn5xD,T-LIGHT HOLDER SWEETHEART HANGING,22789,4.21,3.76,4.13,0.02
RcXxfrf96m2axX5psCiQg3,NUMBER TILE VINTAGE FONT 1,22880,4.21,3.4,4.08,0.03
6LHAL5a6T3PH6MqVpE2Tbn,NUMBER TILE VINTAGE FONT 4,22883,4.21,1.37,1.39,0.67
2jJDtCw2FuK78YNyiFjmnu,NUMBER TILE VINTAGE FONT No,22889,4.21,3.28,3.83,0.09
KyjUGuc9CZzDWfDbdAgDGp,ENAMEL PINK TEA CONTAINER,35809A,4.21,2.91,4.08,0.03
Y5vLBvJhogaideuZajRrj8,4 PINK FLOCK CHRISTMAS BALLS,35833P,3.36,2.47,3.26,0.03
KVgXARwiNcDcwFzXYosKoM,TEA TIME TEAPOT IN GIFT BOX,37500,21.23,11.43,15.5,0.27
LqJvSqixw7pYQhYAuTgFoH,TEA TIME TEA SET IN GIFT BOX,37501,14.43,13.5,13.85,0.04
gXmGfaYrQZJyydgdMsXvJu,PAINTED LIGHTBULB RAINBOW DESIGN,79144C,0.84,0.39,0.66,0.22
mX4a5nEY5nvheLeSwQmSyV,BEADED CRYSTAL HEART GREEN LARGE,85130B,3.36,1.1,2.76,0.18
nKu3ptvvtMwdntAjg8WkPp,SET/6 EAU DE NIL BIRD T-LIGHTS,85170C,4.21,0.13,4.0,0.05
Efey3C48DpSgk6KfkRUNWe,MIDNIGHT BLUE COPPER FLOWER NECKLAC,90000B,6.37,2.98,5.86,0.08
4VArkkL6DgfhkrBUjv7SFs,ROSE COLOUR PAIR HEART HAIR SLIDES,90003B,3.81,2.49,3.16,0.17
Hrdec8zLjPea5CqDGXDeTA,JADE GREEN ENAMEL HAIR COMB,90005A,2.11,1.15,1.81,0.14
DJ4opvjLx5bRGDugd7FpKq,SILVER BLACK ORBIT BRACELET,90019C,5.51,4.35,4.46,0.19
eYFDiKDTpxVheeY6wgsLMj,CRYSTAL SEA HORSE PHONE CHARM,90087,1.66,0.94,0.95,0.43
4fLLA5R66D23ZzSwrmXYp7,2 DAISIES HAIR COMB,90168,2.96,0.63,2.52,0.15
ZfiW6wLq9MuYYfn7X42VKr,DAISY HAIR COMB,90169,2.54,1.48,2.26,0.11
n6GFwKkQGfbr7nNM47LSp6,GREEN DROP EARRINGS W BEAD CLUSTER,90187B,3.39,1.02,2.54,0.25
Esjj9LpmYjs5NiWEdRpwsB,GREEN ENAMEL FLOWER HAIR TIE,90202C,2.96,1.44,1.69,0.43
NuLPzxaC6bE2FVxqtwgHcP,RED   ACRYLIC FACETED BANGLE,90210C,2.96,2.7,2.84,0.04
9NNx8YqVH8ghWZVyC3LoDh,GARDENERS KNEELING PAD,22528,3.36,1.0,3.23,0.04
fedmPtWcDGPDKqyGDgjRFF,DOORMAT FRIENDSHIP,48189,16.98,8.32,10.7,0.37
YMTzftJ7gc577FU3ggjPki,75 GREEN FAIRY CAKE CASES,84989a,2.13,2.01,2.02,0.05
DmJKEL37dChzjFwhqLoaDp,EDWARDIAN PARASOL NATURAL,15056n,12.72,4.65,5.6,0.56
NRmqDKsgNpTZ9UefjEfZy4,COUNTRY COTTAGE  DOORSTOP GREEN,21410,8.47,0.4,5.93,0.3
3CzV3WxtKF4n6iPHUDYiV7,CHILDS GARDEN RAKE BLUE,22516,4.21,4.07,4.13,0.02
9u37WUb9sP5YBLqUCC2hru,3D SHEET OF CAT STICKERS,84559b,1.69,0.9,1.45,0.14
nUZ97ymVbbiZrbopWSFGSH,PINK STITCHED WALL CLOCK,84660c,7.62,2.37,6.63,0.13
fyUL74raGSMf6mz8236dvc,RED ENCHANTED FOREST PLACEMAT,85114c,3.36,2.21,2.82,0.16
QbkM8LpFMEVXt8YaazUuYU,SET/6 FROG PRINCE T-LIGHT CANDLES,85173,5.06,1.61,2.88,0.43
bQTnzCNHNakAjvMyHzW92Z,DOORSTOP FOOTBALL DESIGN,22513,7.62,2.87,6.02,0.21
D8jfu3urS36gFTDZqXdvDW,SET/6 TURQUOISE BUTTERFLY T-LIGHTS,72351a,4.21,0.97,2.19,0.48
LfYSMREh9k5dsCAd6o7acE,SET OF 4 POLKADOT COASTERS,84510c,2.51,2.22,2.36,0.06
RMQbea8BPDA2j7aNb7Ro2N,SMALL DOLLY MIX DESIGN ORANGE BOWL,84596b,2.51,1.41,1.88,0.25
fuDpgDmWKz2BoLYAFyAthQ,ROSE 3 WICK MORRIS BOX CANDLE,85035c,8.47,4.87,6.35,0.25
hbfEq7UNX6TEKjfkXYD5qa,WATERING CAN SINGLE HOOK PISTACHIO,85119,3.36,0.25,1.78,0.47
GydbM8aMqZzJT8DXDkCRiA,CHARLIE + LOLA BISCUITS TINS,85132a,21.23,16.18,18.26,0.14
dg7BpAaPZcbSsjui4Z7my6,FRENCH BLUE METAL DOOR SIGN 4,22679,2.51,0.7,1.51,0.4
hbJE2dmSDTnDPjFrP2WHu7,NUMBER TILE COTTAGE GARDEN 7,22875,4.21,1.15,3.54,0.16
ZsX2rJQ9d5VsLQHc9qwH3b,TEA TIME TABLE CLOTH,47570b,21.23,20.84,20.81,0.02
49zhwDBAm9qE2x3cEY2VXR,3D DOG PICTURE PLAYING CARDS,84558a,5.91,3.3,4.43,0.25
PeVtYZyo5uLMTTYGLy3ain,SILVER VANILLA  FLOWER CANDLE POT,21689,3.75,2.14,3.3,0.12
LSubtXEeT4evFU3ub7QLq4,PACK/12 XMAS FUN CARD,84247E,2.95,0.49,1.09,0.63
eKw5eSXPcusyVhUKitymDr,SET/6 BLACK BIRD T-LIGHT CANDLES,85170B,2.1,1.31,1.81,0.14
abpgNpTtz5NnLq7Ma65DiZ,SET/6 IVORY BIRD T-LIGHT CANDLES,85170A,2.1,0.79,1.43,0.32
3pzA8iT9p9dixpw8UaHFtg,FRENCH ENAMEL WATER BASIN,85059,3.75,0.78,1.72,0.54
bibFJsBULUMeeqg7oWsvV6,BUTTONS AND STRIPES NOTEBOOK,84497,3.75,2.08,2.25,0.4
M2XrpqXyL9hR8Wyk6ohAik,EAU DE NILE JEWELLED T-LIGHT HOLDER,85026B,0.85,0.45,0.71,0.16
ThMe8e29wAheHRbaouTZve,TIGRIS EYE CHUNKY CHARM BRACELET,90175D,8.95,6.58,8.14,0.09
RyUX6q9vLX7K77Qi8PjYtc,DOORSTOP RACING CAR DESIGN,22512,7.62,6.83,7.39,0.03
5M3sF2JbmT7WCbmXidCy6u,VINTAGE UNION JACK SHOPPING BAG,22611,10.17,9.92,9.97,0.02
bLWWMacKjrD3iARpZQzXj7,NUMBER TILE COTTAGE GARDEN 5,22873,4.21,0.59,2.9,0.31
icnjkpznQpgZw3CDNRyepd,PIG MUG IN TWO COLOUR DESIGNS,37467,4.21,3.25,3.49,0.17
DCGHGARrvwgpLuAoNygtdk,"GREETING CARD, STICKY GORDON",84251B,0.85,0.62,0.77,0.09
bawBdYLaMdYwwL5xwEvN2K,LA PALMIERA TILE HOOK,84927D,4.21,0.17,2.02,0.52
cLmw7dpSkqawA3bxZgWGMD,S/4 PINK FLOWER CANDLES IN BOWL,85040A,3.36,1.94,2.49,0.26
ZdzTS3jetE37DUCgT3Es6d,MINI  ZINC GARDEN DECORATIONS,85213,1.66,0.85,1.21,0.27
DUak84UN9uoj8VHpzNaF5S,ANTIQUE OPAL WHITE FLOWER EARRINGS,90001C,4.24,3.56,4.07,0.04
AK5zTkWfahHassHZrr7BuE,SILVER M.O.P ORBIT BRACELET,90019A,5.51,3.79,4.74,0.14
PGMVx3wyDNWnRSzDih5HLc,FILIGREE DIAMANTE EARRINGS,90023,4.24,4.21,4.16,0.02
agqGueS4mZKWSxWQFj9K5k,GLASS BEAD HOOP EARRINGS BLACK,90027A,2.96,1.55,1.63,0.45
Dt5u272keZxrsx2SWWGtDk,DAISY HAIR BAND,90170,1.69,0.8,1.23,0.27
H8NcJaZPdKyYe2XCjiowTh,CRYSTAL HOOP EARRING FLORAL LEAF,90186B,2.96,2.56,2.63,0.11
6B6LLb34kZ5GQHF5muymEj,VINTAGE ROSE BEAD BRACELET RASPBERR,90198A,4.24,0.44,1.4,0.67
NuheUWzhopQnqWbuZc4XpG,JET BLACK LAS VEGAS NECKLACE 45CM,90211B,5.94,3.93,5.11,0.14
ewQpF4VGGjUW4fxxA5aLeM,"LETTER ""K"" BLING KEY RING",90214K,0.85,0.53,0.76,0.11
GoQCCBdgPb2tc9wveSJz8y,"LETTER ""P"" BLING KEY RING",90214P,0.85,0.28,0.82,0.04
SuoLravrg39apEn7XKAKUm,"LETTER ""Z"" BLING KEY RING",90214Z,0.85,0.54,0.69,0.19
AkRSkkjaA6SHMYzz7ComeN,QUEEN OF THE SKIES HOLIDAY PURSE,20663,2.51,0.24,1.13,0.55
e9LdCuTHxJg3Qh57GpVmvv,BLUE  TILE HOOK,20794,5.06,2.5,2.88,0.43
2UuCcgxjkrfw3ZPSyKM7Gb,ANTIQUE CREAM CUTLERY SHELF,21269,16.98,9.4,12.06,0.29
kY8UZwfYFbVzPHen2wSTCf,CLASSIC FRENCH STYLE BASKET GREEN,21792,13.57,5.55,10.45,0.23
58dNUYFWNcPqHBGuyUzYpQ,PURPLE LAS VEGAS BRACELET ROUND,90212C,3.75,0.15,3.04,0.19
dnxT6w8fKHLmJCqhj79FFM,WRAP DOLLY GIRL,22708,0.42,0.4,0.4,0.04
U4XFRStPCkGUDxzaTjqgWi,BIRTHDAY BANQUET GIFT WRAP,22048,0.42,0.26,0.34,0.2
X4bkCZAEtLLHXDxY2XXbhJ,CERAMIC PLATE STRAWBERRY DESIGN,22057,1.49,0.47,1.45,0.03
dUWgcfRTBpxKPXgV5szWYA,BAKING MOULD HEART MILK CHOCOLATE,22930,2.55,1.05,1.68,0.34
jfXwSchsnHaFrwvNa7m2c8,BAKING MOULD HEART WHITE CHOCOLATE,22931,2.55,0.65,1.63,0.36
aeqeeHpGebUVQjZ9BPWTS3,BAKING MOULD TOFFEE CUP CHOCOLATE,22932,2.55,1.0,1.68,0.34
4JXQEWrcnmoGo9vbEaRB8G,BAKING MOULD CHOCOLATE CUPCAKES,22937,2.55,1.11,1.61,0.37
KkhzUmxRfcfHFXrkSviUXX,WRAP I LOVE LONDON,22710,0.42,0.11,0.3,0.29
X9374idRKJbuE25Pw5sAgm,BLUE SCANDINAVIAN PAISLEY WRAP,22051,0.42,0.38,0.41,0.03
UX7VYnAki8FSwXaV4DGwyw,BAKING MOULD ROSE WHITE CHOCOLATE,22936,3.25,0.15,2.31,0.29
bhhqRPkfpQ7XDNCMQdWFVH,BAKING MOULD ROSE MILK CHOCOLATE,22935,3.25,0.07,1.56,0.52
5qPQU5DY2CxVVPT7cLdxRE,ZINC TOP  2 DOOR WOODEN SHELF,21275,14.95,2.37,14.05,0.06
atiHZ742EdoSDgwnkQ4yGE,CREAM SWEETHEART SHELF + HOOKS,85068,7.95,4.14,7.79,0.02
BXGKh6ZsEeh4HBUAmJV4CR,FUSCHIA VOILE POINTY SHOE DEC,47348A,1.95,0.23,1.85,0.05
hKrBk9bnBsqnSkFA42tt4w,MEDINA STAMPED METAL STOOL,21686,39.95,33.69,34.36,0.14
N4KZdR6DwBgT8rUmdRpgNG,PINK SMALL JEWELLED PHOTOFRAME,85024C,1.65,1.29,1.32,0.2
9CtHPNYnKnDqFEsLbXP7BV,WHITE HANGING BEADS CANDLE HOLDER,71038,5.45,4.8,4.91,0.1
jTyNQcMF5WwrXNjE8Eyzrn,BLUE NEW BAROQUE FLOCK CANDLESTICK,84613C,4.65,2.65,2.84,0.39
Foa7JUHXJaJSzx7LhjZN8h,PINK PAISLEY CUSHION COVER,84910A,5.95,0.26,5.53,0.07
QMwJhnXM5TgrQH4rRVWR6k,RED RETROSPOT BIG BOWL,21246,4.95,0.83,3.37,0.32
AnZ2KBH6DsVfodoSpYRdmZ,LARGE  TALL CAMPHOR WOOD TOADSTOOL,21376,5.45,5.03,5.18,0.05
Ap8TsE4v4AkjjSCn4cJnGo,QUEEN OF THE SKIES PASSPORT COVER,20618,2.1,0.67,1.39,0.34
FYNDZHXmHVzEYgoTAm5hN4,BLACK PHOTO ALBUM,16202E,5.55,2.79,3.88,0.3
ktbpdfv2R2QKxQN9t6QZTy,ASSORTED COLOUR SUCTION CUP HOOK,47420,0.19,0.01,0.03,0.82
DEEs8J7okg6zACQheS6XtY,GINGHAM BABUSHKA DOORSTOP,22510,3.75,1.9,3.19,0.15
4AA4YeCePKH4Gr9ipJ9crk,DOORMAT MULTICOLOUR STRIPE,48116,7.95,3.52,5.88,0.26
kqciJ9pruwGEYDt8G6mq3X,IVORY SCULPTED RND CANDLE,72709,0.85,0.76,0.81,0.05
nLkeAfRpwWKGHNiq3d4oFg,COLUMBIAN CUBE CANDLE,72132,1.95,1.3,1.5,0.23
Dwrjiticxzt5SEDjSJ6EwH,HEART T-LIGHT HOLDER,85118,1.25,0.7,0.84,0.33
fCx7vc6xC7QAjUzrATCqGq,FOLK ART METAL HEART T-LIGHT HOLDER,35968,0.38,0.19,0.32,0.15
GNffjTG6AoA5FLw8USyeRn,CERAMIC BOWL WITH STRAWBERRY DESIGN,22063,2.95,1.26,2.83,0.04
G3CQDa4iXTCmqvmCxPmJAm,AMETHYST CHUNKY BEAD BRACELET W STR,90184B,8.95,4.9,6.35,0.29
jrhVEQCtFMZLxh4L27P9sA,AMBER CHUNKY BEAD BRACELET W STRAP,90184A,8.95,1.94,3.49,0.61
9xLYu8ELuSc2DiyRydV8UY,BLUE FLOCK CUSHION COVER,84415B,3.75,1.76,2.85,0.24
FzUHDB3DJtWhUie2kcCQjw,VINTAGE NOTEBOOK BEAUTY GIRL,20906,2.95,1.99,2.63,0.11
oMcN8XHh3ejHfa85QWcevu,BLUE PADDED SOFT MOBILE,20703,4.25,4.01,4.12,0.03
5w9TAc8HQm8qEuWiPFSF8M,CD WALL TIDY RED FLOWERS,71495B,0.42,0.3,0.36,0.14
Y3oBP2oE6N2uSbbLiAZChc,MAGAZINE RACK GEBRA ASSORTED,78124,2.75,1.49,1.73,0.37
nCbAjP7ibVqmJrWpudNhNL,FROSTED WHITE BASE,79403,1.66,0.52,0.8,0.52
gDvn2TYCikbdL565T7Gu4u,"GREETING CARD, OVERCROWDED POOL.",84251G,0.85,0.68,0.69,0.19
NyCFMFd8xJDTQdKwuyyyy5,WHITE SILVER NECKLACE SHELL GLASS,90034,10.19,2.1,4.48,0.56
AMRJYHkVbKsidAwNgwevmX,MURANO STYLE GLASS BRACELET GOLD,90040C,3.81,3.18,3.62,0.05
3ciiDvBNDuoxaaUKFGqK4P,DIAMANTE HAIR GRIP PACK/2 PERIDOT,90059D,1.69,0.75,0.83,0.51
cdP43mC7ynPagRnaKxbEmk,PINK CRYSTAL SKULL PHONE CHARM,90089,1.66,0.35,0.46,0.72
7FPDYNie9DSMHZDXwixbXu,PINK MURANO TWIST BRACELET,90120A,4.24,0.74,3.77,0.11
bVThS78E3iRfNXXTPfB9dn,GREEN ENAMEL FLOWER RING,90201D,2.96,1.14,2.19,0.26
9ExVYogfQ9UEZWnCAcNDqf,ORIGAMI ROSE INCENSE IN TUBE,17013D,3.36,3.21,3.26,0.03
