id,Description,StockCode,UnitPrice,ProfitMargin,DiscountedPrice,DiscountPct
PC2ateVtar7F96T4LAczZQ,WHITE HANGING HEART T-LIGHT HOLDER,85123A,2.55,1.4,1.99,0.22
FUmgPgJKTQqJsEnL5vcfMr,WHITE METAL LANTERN,71053,3.39,0.58,2.27,0.33
cvEJW5C9SL22NdxMrRdvdh,CREAM CUPID HEARTS COAT HANGER,84406B,2.75,2.64,2.69,0.02
57xLimSFCmu5BrECaVvDei,KNITTED UNION FLAG HOT WATER BOTTLE,84029G,3.39,2.6,2.61,0.23
NMQ5XeVRD3uFFbmDKgitNP,RED WOOLLY HOTTIE WHITE HEART.,84029E,3.39,2.81,3.12,0.08
PTNq9ViYVqUzS6QgPDfxVE,SET 7 BABUSHKA NESTING BOXES,22752,7.65,3.0,3.83,0.5
maTvV35cgGkLbt3HqrogxZ,GLASS STAR FROSTED T-LIGHT HOLDER,21730,4.25,1.19,4.04,0.05
2rj3UN5mXUT6dxDcEiWB4e,HAND WARMER UNION JACK,22633,1.85,1.43,1.48,0.2
gakNYrhu2ELcN8bQmnYzM7,HAND WARMER RED POLKA DOT,22632,1.85,1.42,1.81,0.02
AzdoAeeNWrz5tenkuynaHm,ASSORTED COLOUR BIRD ORNAMENT,84879,1.69,1.67,1.66,0.02
bQ9jJQrqM8477bR4JJRphz,POPPY'S PLAYHOUSE BEDROOM,22745,2.1,1.44,1.49,0.29
nYB8RMwVNS8nS8nek48Syh,POPPY'S PLAYHOUSE KITCHEN,22748,2.1,1.47,1.93,0.08
NfLTUbDSvhxYeYUG8hcJzN,FELTCRAFT PRINCESS CHARLOTTE DOLL,22749,3.75,0.85,2.21,0.41
KjMJxXJtSpYqmQnYaZuUUc,IVORY KNITTED MUG COSY,22310,1.65,0.08,1.14,0.31
7u2pvZtSo3wcbVHRAhpNha,BOX OF 6 ASSORTED COLOUR TEASPOONS,84969,4.25,3.85,3.91,0.08
Z9xQwkttMvC6My2RTtNuZs,BOX OF VINTAGE JIGSAW BLOCKS,22623,4.95,4.89,4.85,0.02
MggshfeBz2QxWQHSy9vojw,BOX OF VINTAGE ALPHABET BLOCKS,22622,9.95,0.26,0.7,0.93
PJ3U6kPh3Xyd6h2YTR23ds,HOME BUILDING BLOCK WORD,21754,5.95,4.85,5.06,0.15
2wtPQ6vPfgsDL3BqETJV5j,LOVE BUILDING BLOCK WORD,21755,5.95,4.36,5.53,0.07
cjeKkeaD98FxqRNrvGgUMM,RECIPE BOX WITH METAL HEART,21777,7.95,0.69,2.15,0.73
KXY23jiZnS4RatP5MaaTNA,DOORMAT NEW ENGLAND,48187,7.95,5.06,6.04,0.24
c7s9wqHEGQBDdFcWP2ogJE,JAM MAKING SET WITH JARS,22960,4.25,3.53,3.61,0.15
MAN8TAV5qro5iaTihRktoh,RED COAT RACK PARIS FASHION,22913,4.95,1.01,4.75,0.04
HgUAxtwEbAns6dM3ToWv6C,YELLOW COAT RACK PARIS FASHION,22912,4.95,0.45,2.92,0.41
CP2YzUCy2TNCmNbXJRGmq7,BLUE COAT RACK PARIS FASHION,22914,4.95,3.34,4.21,0.15
bCMnPuAXZic2Vhkxet5aRD,BATH BUILDING BLOCK WORD,21756,5.95,5.95,5.95,0.0
FmsVMACFaWRT2cJgNjtYGH,ALARM CLOCK BAKELIKE PINK,22728,3.75,1.69,3.34,0.11
mgiuiTYHxgHNy2HxnUCFN6,ALARM CLOCK BAKELIKE RED,22727,3.75,3.36,3.49,0.07
ZW74ybw4729EwJar4FvuSy,ALARM CLOCK BAKELIKE GREEN,22726,3.75,3.65,3.67,0.02
RCpwffVDt7FnbrFWYQKUyL,PANDA AND BUNNIES STICKER SHEET,21724,0.85,0.49,0.82,0.03
Udz9CE5dfaEbcpoKR8bgKC,STARS GIFT TAPE,21883,0.65,0.47,0.5,0.23
Ni5DdRREFM24dAc8XFW6N3,INFLATABLE POLITICAL GLOBE,10002,0.85,0.43,0.82,0.03
VJaRXAkScSDzYsfUHsFcQk,VINTAGE HEADS AND TAILS CARD GAME,21791,1.25,0.73,1.05,0.16
K8M3e4ABk6tJRNVHvDgYss,SET/2 RED RETROSPOT TEA TOWELS,21035,2.95,2.94,2.89,0.02
P7zfHMzEP5kpAZtgAtPxN3,ROUND SNACK BOXES SET OF4 WOODLAND,22326,2.95,1.63,1.95,0.34
DTvrfTpmdpdG5eKQAMU5Da,SPACEBOY LUNCH BOX,22629,1.95,0.5,1.36,0.3
EZRMoqo4VGAeWZkaMzBi3t,LUNCH BOX I LOVE LONDON,22659,1.95,1.48,1.68,0.14
kWcibu8fBBGNw7UvToA4VL,CIRCUS PARADE LUNCH BOX,22631,1.95,0.84,1.5,0.23
kJTEtafpNoQ5erWNoEaRtm,CHARLOTTE BAG DOLLY GIRL DESIGN,22661,0.85,0.81,0.82,0.04
6PxSs7HbucG6eoNLooTWUL,RED TOADSTOOL LED NIGHT LIGHT,21731,1.65,1.55,1.55,0.06
Apjmu3LwAC5R4SzWrKTzJG,SET 2 TEA TOWELS I LOVE LONDON,22900,2.95,2.31,2.54,0.14
gNtPyPEzJY3p5UkfN67TKF,VINTAGE SEASIDE JIGSAW PUZZLES,21913,3.75,3.58,3.6,0.04
mHzZ2YrYDRSGUaoqBYLFRc,MINI JIGSAW CIRCUS PARADE,22540,0.42,0.13,0.17,0.59
78CVHRLuUgVusXsXFyPiEk,MINI JIGSAW SPACEBOY,22544,0.42,0.08,0.22,0.48
CYTJN3C8vrkyNNWNbxJGqz,MINI PAINT SET VINTAGE,22492,0.65,0.18,0.29,0.55
5d4wsERAA6kqfJjxg7bKNK,PAPER CHAIN KIT 50'S CHRISTMAS,22086,2.55,0.14,2.45,0.04
jHWe7V72g5DrL5iuYYXYDn,EDWARDIAN PARASOL RED,20679,4.95,3.37,4.7,0.05
5c9vVMQYUEuBhyuPKHoZgD,RETRO COFFEE MUGS ASSORTED,37370,1.06,0.25,0.65,0.39
5TSuK8kuGTvzfLnAbzed3Z,SAVE THE PLANET MUG,21871,1.06,0.81,0.87,0.18
7YmNQ3yRGQ7dW4k3Cce5Zt,VINTAGE BILLBOARD DRINK ME MUG,21071,1.06,0.93,1.04,0.02
cCoKZoHD5MS37aBAbevgTh,VINTAGE BILLBOARD LOVE/HATE MUG,21068,1.06,0.36,0.87,0.18
66p2TaYfetTpADzKUdun2p,WOOD 2 DRAWER CABINET WHITE FINISH,82483,4.95,4.24,4.55,0.08
jQVSQuLR7LdsxdYjbEAXkq,WOOD S/3 CABINET ANT WHITE FINISH,82486,6.95,4.22,4.93,0.29
5H2brNctgDyTZtuxrnbMvs,WOODEN PICTURE FRAME WHITE FINISH,82482,2.1,1.53,1.55,0.26
XaPNZsRctVuQLSqCq3yEV7,WOODEN FRAME ANTIQUE WHITE,82494L,2.55,2.12,2.32,0.09
oUDjtvuCSNLh3tejk7EsrP,VICTORIAN SEWING BOX LARGE,21258,10.95,7.86,10.62,0.03
57Cb7qGfSZsRjEwYjiyhuu,HOT WATER BOTTLE TEA AND SYMPATHY,22114,3.45,1.27,2.59,0.25
PfiRHZbWmSMZrrTkJHNunh,RED HANGING HEART T-LIGHT HOLDER,21733,2.55,1.25,1.63,0.36
Uh7ncnMLza9gjLJWQL7NYD,JUMBO BAG PINK POLKADOT,22386,1.95,1.07,1.6,0.18
oRPWPYCUoPMDzbuNLoDAGf,JUMBO  BAG BAROQUE BLACK WHITE,85099C,1.95,1.84,1.85,0.05
WPxzNWVP7uAVLDwtomYXQJ,JUMBO BAG CHARLIE AND LOLA TOYS,21033,2.95,1.69,1.74,0.41
DE6XdGmUDXkoxr4NZDJKFK,STRAWBERRY CHARLOTTE BAG,20723,0.85,0.12,0.48,0.44
BJTgGbmJBxn6ZEebSiPe5T,RED 3 PIECE RETROSPOT CUTLERY SET,84997B,3.75,3.21,3.3,0.12
cr56W7MYWf7fbWbXMh6ru9,BLUE 3 PIECE POLKADOT CUTLERY SET,84997C,3.75,2.75,3.64,0.03
PwfAgKJjSaFjTiMrJkkfTT,SET/6 RED SPOTTY PAPER PLATES,21094,0.85,0.41,0.61,0.28
Wabde6BabWA4msKXQpn2iP,LUNCH BAG RED RETROSPOT,20725,1.65,1.57,1.6,0.03
hRivLga3T9NrNy6cN2siMW,STRAWBERRY LUNCH BOX WITH CUTLERY,21559,2.55,1.77,2.24,0.12
az7G8EVqhvb8nMN7UryXuJ,LUNCH BOX WITH CUTLERY RETROSPOT,22352,2.55,1.57,2.01,0.21
74b6vdf86QxxW9Q27aoJGM,PACK OF 72 RETROSPOT CAKE CASES,21212,0.42,0.06,0.36,0.14
6U4qfGVahDSTUoSQNkvH8v,PACK OF 60 DINOSAUR CAKE CASES,21975,0.55,0.41,0.48,0.12
BTXoDYMfyMxYLKs2uRSSwq,PACK OF 60 PINK PAISLEY CAKE CASES,21977,0.55,0.17,0.4,0.28
iz4pQxAPZYmQ2vLuSzrp5p,60 TEATIME FAIRY CAKE CASES,84991,0.55,0.26,0.48,0.13
EeMjmvdfFQqsWDEbsZJaRD,TOMATO CHARLIE+LOLA COASTER SET,84519A,2.95,0.47,2.09,0.29
Livq4EwhnETSsU296hVQK8,CHARLIE & LOLA WASTEPAPER BIN FLORA,85183B,1.25,1.11,1.2,0.04
3KpJwDN29eMzAjcUNhkX2x,RED CHARLIE+LOLA PERSONAL DOORSIGN,85071B,0.38,0.31,0.35,0.08
ECwGZskttfB7zwWYjPe8ZW,JUMBO STORAGE BAG SUKI,21931,1.95,0.88,1.15,0.41
haRqp2FUyvbpRgghzLXQje,JUMBO BAG PINK VINTAGE PAISLEY,21929,1.95,1.1,1.36,0.3
ZFLBNwBRqkSCd8hwJDLNMf,JAM MAKING SET PRINTED,22961,1.45,1.04,1.3,0.1
YqGi4MQYAgUAvMxr6JVK2N,RETROSPOT TEA SET CERAMIC 11 PC,22139,4.25,2.67,3.27,0.23
RGTCDkrSXPjuHhSt4ww4tg,GIRLY PINK TOOL SET,84854,4.95,2.03,3.76,0.24
bugyii7NX35q37FQXf4iG8,JUMBO SHOPPER VINTAGE RED PAISLEY,22411,1.95,1.77,1.87,0.04
8GYY3nWaTG52MQJQeHF3TQ,"AIRLINE LOUNGE,METAL SIGN",82567,2.1,1.92,1.93,0.08
DT2fCywhzXSQNdh78hunfT,WHITE SPOT RED CERAMIC DRAWER KNOB,21672,1.25,0.22,0.45,0.64
4SouUW8EsG9Z7sfJa825Py,RED DRAWER KNOB ACRYLIC EDWARDIAN,22774,1.25,0.85,0.99,0.21
SsJUHVumwLHckFvTc2HXpw,CLEAR DRAWER KNOB ACRYLIC EDWARDIAN,22771,1.25,0.56,0.84,0.33
fa8ZSmK8QzLtbjukDAHQCR,PHOTO CLIP LINE,71270,1.25,0.38,0.41,0.67
P3cETzqHTtLQuUjepQkmtF,FELT EGG COSY CHICKEN,22262,0.85,0.31,0.31,0.63
KrgM7AcUNvqWqk4J543hir,PIGGY BANK RETROSPOT,22637,2.55,2.3,2.45,0.04
LwuqSgexzEG2ctJqwuFN9E,SKULL SHOULDER BAG,21934,1.65,0.07,1.3,0.21
RJCC4UHrCYXw6hy8e7ZCC9,YOU'RE CONFUSING ME METAL SIGN,21169,1.69,1.55,1.57,0.07
WQQVBHaMbMWXESWVTdAjVR,COOK WITH WINE METAL SIGN,21166,1.95,1.83,1.87,0.04
XayYUJRCzaaUjBTPZVXtNP,GIN + TONIC DIET METAL SIGN,21175,2.1,0.52,2.02,0.04
dZYBWfUJz6TMkCF2hx9ix3,YELLOW BREAKFAST CUP AND SAUCER,37444A,2.95,0.88,2.09,0.29
enmULJHFmRPbwkizh3uYSq,PINK BREAKFAST CUP AND SAUCER,37444C,2.95,0.57,1.98,0.33
NKHWGvJHFXvNvUq6TLErC7,PAPER CHAIN KIT RETROSPOT,22083,2.95,0.17,0.8,0.73
hLvk3DsUEGdVaY9vqWYxWR,SMALL HEART FLOWERS HOOK,84971S,0.85,0.53,0.65,0.23
cL5cgxLC2ey78z6f6vp98W,TEA TIME DES TEA COSY,47580,2.55,1.28,1.38,0.46
gTDiKoyRek2dR6dzTqsnV7,FELT EGG COSY WHITE RABBIT,22261,0.85,0.41,0.61,0.28
fr67JeBQMesUWK6384vcXJ,ZINC WILLIE WINKIE  CANDLE STICK,84832,0.85,0.02,0.35,0.59
ZwnSB4xBev7QLgGYsGeoyc,CERAMIC CHERRY CAKE MONEY BANK,22644,1.45,0.34,0.72,0.5
eFXuEawgi7W7p9ZpGYQWSK,RETROSPOT LARGE MILK JUG,21533,4.95,2.2,2.28,0.54
PhMjrABdth89BfBd6epgbD,SET OF 6 FUNKY BEAKERS,21557,2.95,0.79,0.8,0.73
XA3oxPMjB6GHp7vh7ytRFa,EDWARDIAN PARASOL BLACK,15056BL,5.95,2.42,3.51,0.41
QjBaiVRQBEeSELeMo63Ysn,EDWARDIAN PARASOL NATURAL,15056N,5.95,5.87,5.83,0.02
4QGAYtgJoBqbSjPUF6r4Ri,CERAMIC STRAWBERRY CAKE MONEY BANK,22646,1.45,0.6,1.12,0.23
5YCz6asxLHJhEvtyBXdfwV,BLUE OWL SOFT TOY,22176,2.95,2.24,2.3,0.22
gXc6wv8V7TvRhp3eYbDgFQ,BALLOON ART MAKE YOUR OWN FLOWERS,22438,1.95,1.67,1.74,0.11
kARadME8XNnYat8D98nUVt,GLASS CLOCHE SMALL,22778,3.95,1.81,3.4,0.14
EcVWfU5UGUEcT3Vhp5Vbo9,GUMBALL MONOCHROME COAT RACK,22719,1.06,0.2,0.36,0.66
PzsDM4Po99m7NMHSvjB97z,DOORMAT FANCY FONT HOME SWEET HOME,21523,6.75,6.58,6.62,0.02
YW3aCbkc7LXq4eEHiDYeXg,VINTAGE SNAKES & LADDERS,21912,3.75,0.48,2.74,0.27
WJwTjwpH6UwHSxZYzsDopP,CHOCOLATE CALCULATOR,21832,1.65,1.43,1.45,0.12
ia3tcrpy38Gih7QFeCBhL7,RECYCLING BAG RETROSPOT,22379,2.1,0.52,1.26,0.4
STaN4PcWHtGHwjsaLHUWtJ,TOY TIDY PINK POLKADOT,22381,1.85,1.44,1.76,0.05
UQLhUZDBXtahZz9gLCzydF,ANTIQUE GLASS DRESSING TABLE POT,22798,2.95,0.1,1.95,0.34
Px74s97zWSFq4D8CqS9B6J,IVORY GIANT GARDEN THERMOMETER,22926,5.95,2.39,5.18,0.13
Z8GMVA62ahsrQQ5ENfyU7d,3 TIER CAKE TIN GREEN AND CREAM,22839,14.95,5.11,13.01,0.13
Y7nK8v2NyX94KiXpNKd768,3 TIER CAKE TIN RED AND CREAM,22838,14.95,7.72,8.22,0.45
KWgb9XqBHs9WSdboHQoV9f,SET 3 WICKER OVAL BASKETS W LIDS,22783,16.95,13.8,15.42,0.09
LDJ6wEHAXdcuSXFTbUEqvW,SET OF 3 COLOURED  FLYING DUCKS,35004C,4.65,4.37,4.51,0.03
LwoxWbNYfjsCyQvzXWAfHN,WOOD BLACK BOARD ANT WHITE FINISH,82484,6.45,2.47,6.06,0.06
fTDnPeNEf6fatRSbj48oFQ,COLOUR GLASS T-LIGHT HOLDER HANGING,84755,0.65,0.28,0.44,0.32
dsaNHqb5bHDoCsMXCU6tDf,HANGING METAL HEART LANTERN,22464,1.65,1.38,1.55,0.06
FGqgKFaFWh4DeyhY3KuooB,HANGING MEDINA LANTERN SMALL,21324,2.95,1.23,1.95,0.34
c3H9fA5LoqvyEN7DQW9Fx8,NATURAL SLATE HEART CHALKBOARD,22457,2.95,0.46,1.77,0.4
ERFw5DtdsTqozVR2eQjt8S,HEART OF WICKER SMALL,22469,1.45,0.51,1.06,0.27
Aa6xmbP5y8cR589RDoG6tC,HEART OF WICKER LARGE,22470,2.55,1.39,1.43,0.44
TDtEpmRMV9W8CS7HnaEKj5,WHITE LOVEBIRD LANTERN,22224,2.95,2.29,2.39,0.19
E6k9qu9XvXETJJ5YzcEK2J,CLASSIC METAL BIRDCAGE PLANT HOLDER,21340,12.75,5.05,11.22,0.12
ZfoH8wc7MdGXTnFEjTxx8G,CREAM HEART CARD HOLDER,22189,3.95,2.51,2.88,0.27
oYsuohPggqTA63HJsu6a44,ENAMEL FLOWER JUG CREAM,22427,5.95,5.64,5.71,0.04
53HF8S9ipyeLqxSJoxy3u3,ENAMEL FIRE BUCKET CREAM,22428,6.95,2.11,2.57,0.63
bhMexHKTEzyJEfNCEKYviH,ENAMEL BREAD BIN CREAM,22424,10.95,2.73,4.27,0.61
NzHSfHtbucJzBR9SWjRaJW,JUMBO BAG DOLLY GIRL DESIGN,22663,1.95,0.59,1.25,0.36
CbdaTCHSE4fnCMmToLfbmJ,TRADITIONAL CHRISTMAS RIBBONS,85049A,1.25,0.81,0.89,0.29
VjCYHsbWUy7ELiZzgoCrj4,ORGANISER WOOD ANTIQUE WHITE,22168,8.5,7.8,8.16,0.04
2sYC3tcqRNWbkPJrKntqfS,LUNCH BAG DOLLY GIRL DESIGN,22662,1.65,0.26,0.43,0.74
Jj8Hhturft3uxvQpBifRQ2,WHITE WIRE EGG HOLDER,84880,4.95,1.6,1.78,0.64
cw4r5dZwAMsC2uZCZz33qH,JUMBO BAG RED RETROSPOT,85099B,1.65,0.14,0.31,0.81
3KcW2aJV2mLQPzZ8zhstVs,CHILLI LIGHTS,79321,3.82,2.33,3.02,0.21
7BkCtnHLCwXPorcF4Jhar3,LIGHT GARLAND BUTTERFILES PINK,22780,3.37,2.52,2.9,0.14
enjGCQgNBgtdkHLDwyCYgW,WOODEN OWLS LIGHT GARLAND,22779,3.37,2.68,2.8,0.17
KHWKYGBJUD2MRbEC3VjS6n,FAIRY TALE COTTAGE NIGHTLIGHT,22466,1.45,1.31,1.42,0.02
iCZrrnUE6pCQVi3WmbbDyn,HOME SMALL WOOD LETTERS,21363,4.95,4.17,4.55,0.08
dECJjn9Xx597uQb7ZUgP4p,GINGHAM HEART  DOORSTOP RED,21411,4.25,4.15,4.17,0.02
6YuKe5BqQ5rcaYBsLrWZnp,FIVE HEART HANGING DECORATION,22318,2.95,2.43,2.54,0.14
jvtRMan9UyANsdfppyXNc7,ASSORTED BOTTLE TOP  MAGNETS,22915,0.42,0.19,0.24,0.44
4Dz5zeDKUsEDBTET4mGoYb,FRIDGE MAGNETS US DINER ASSORTED,22922,0.85,0.48,0.76,0.11
RkSrvhHjD5UJmBPPY27u5x,HOMEMADE JAM SCENTED CANDLES,22969,1.45,0.73,0.81,0.44
JGXCEp8JsefB3PvnxZJxW5,FRIDGE MAGNETS LES ENFANTS ASSORTED,22923,0.85,0.45,0.68,0.2
Xn5EmAKGs9F9PXZ6TQgHpr,ROSE CARAVAN DOORSTOP,21115,6.75,6.66,6.62,0.02
T2MmJnVLuG8cMe46iK9D45,5 HOOK HANGER MAGIC TOADSTOOL,22242,1.65,1.31,1.39,0.16
HjBQMAZ3C85i7fXz2AvnGt,CHRISTMAS LIGHTS 10 REINDEER,22941,8.5,2.76,5.95,0.3
kZW8LMjcAhmTJrKkgozkrv,VINTAGE UNION JACK CUSHION COVER,21622,4.95,4.91,4.9,0.01
TgCpqGaPrXfuVQhn24k6tU,SET OF 3 GOLD FLYING DUCKS,35004G,6.35,0.29,1.33,0.79
ifkqksHxU9RrLuK4irkm4z,RED RETROSPOT UMBRELLA,85014B,5.95,2.34,3.57,0.4
UcYYUChMqvPxZkD4pA9VXc,BLACK/BLUE POLKADOT UMBRELLA,85014A,5.95,4.29,4.7,0.21
Mp77asVpVMPh2KRn8qCfsB,RED DINER WALL CLOCK,22193,8.5,1.5,3.06,0.64
9Vj7rnSJsvpj9yhTKXDPr7,BLUE DINER WALL CLOCK,22192,8.5,2.35,3.4,0.6
eQdCuYHDuchKtBQM2znzTf,IVORY DINER WALL CLOCK,22191,8.5,4.86,7.57,0.11
CFWwNH8Y8LbwptCSsz9wqf,LARGE HEART MEASURING SPOONS,22195,1.65,0.17,1.3,0.21
P77LEjB4vvS3RwsFRTKpUu,SMALL HEART MEASURING SPOONS,22196,0.85,0.61,0.66,0.22
o9xvJaryqafKBxDAu3MD67,JAM JAR WITH PINK LID,22962,0.72,0.08,0.5,0.3
56fiKpsBuTrZHAaGwYbccL,JAM JAR WITH GREEN LID,22963,0.72,0.06,0.41,0.43
SqqK37QFmQ2CxAMvXST8Dm,ROSE COTTAGE KEEPSAKE BOX,22968,8.5,1.25,6.8,0.2
Z4NkHeZ32ECrMKKPzpDXZz,HANGING HEART ZINC T-LIGHT HOLDER,84970S,0.64,0.3,0.6,0.07
NcnQ9A89nv5Uw8yDCahe49,PAPER CHAIN KIT VINTAGE CHRISTMAS,22910,2.55,1.28,2.35,0.08
jyvmb3tqgBn4HRXjrmWyeX,DISCO BALL CHRISTMAS DECORATION,20668,0.1,0.09,0.1,0.05
nHvwjpnzbyXeZKREMRRaRu,SMALL POPCORN HOLDER,22197,0.72,0.29,0.49,0.32
gWgnn2M8vTUtPGwiLHdMfJ,LARGE POPCORN HOLDER,22198,1.45,0.69,1.3,0.1
gyULU26wY7kxFPk8Tcmu4M,SET/20 RED RETROSPOT PAPER NAPKINS,21080,0.64,0.05,0.6,0.07
HKgvi74YCBmBgb3cQbKDUJ,SET/6 RED SPOTTY PAPER CUPS,21086,0.65,0.59,0.6,0.08
k9ufHu8wWSx9QEPZo5shgo,POLKADOT RAIN HAT,21786,0.32,0.27,0.28,0.12
A2LyqcAy8UxHGQhKhaktiP,DELUXE SEWING KIT,22654,4.95,4.09,4.5,0.09
NEqmPzAspdHDfUVfUtEtet,RETROSPOT HEART HOT WATER BOTTLE,21485,4.25,1.69,3.87,0.09
6b9LKndeA4NB6cKwRHoyWn,ENGLISH ROSE HOT WATER BOTTLE,84030E,3.75,0.09,1.54,0.59
CKJwWvUyaxhSkc5j9xSysg,PHOTO CUBE,22174,1.48,0.72,1.04,0.3
7Tj4Cy95iXKz37zDTgFsGz,PLASTERS IN TIN CIRCUS PARADE,22556,1.65,0.11,1.12,0.32
9ta4Aa5kbeGdZkMzPho8nv,PACK OF 12 PINK PAISLEY TISSUES,21984,0.29,0.18,0.25,0.15
bVsdV9KL59WsRPuScJZGoH,PACK OF 12 BLUE PAISLEY TISSUES,21983,0.29,0.2,0.27,0.07
SctqtEduMm4cweJkGiSSMF,PACK OF 12 RED RETROSPOT TISSUES,21980,0.29,0.17,0.26,0.12
jbWgD3Sqhn7q65EtYfeo4t,CHICK GREY HOT WATER BOTTLE,21484,3.45,1.84,2.04,0.41
g4fGZ6kZaFs9BFL7xuKnjQ,PLASTERS IN TIN VINTAGE PAISLEY,22557,1.65,1.64,1.62,0.02
cw7fXFKR9nvMcMh8L3Zz9q,PLASTERS IN TIN SKULLS,22553,1.65,0.37,0.46,0.72
QCzsenrRQCN6dVYfC2sNcd,3 STRIPEY MICE FELTCRAFT,22150,1.95,0.11,0.64,0.67
MM364h68iE2YWXQqcpmc63,SET OF 6 SOLDIER SKITTLES,22619,3.75,1.44,1.54,0.59
Qtc2JnHVLPiafakXvutdZZ,TRADITIONAL WOODEN SKIPPING ROPE,21891,1.25,0.96,1.06,0.15
MLr3BbJVWuW5Xbtju9obBc,WOODEN BOX OF DOMINOES,21889,1.25,0.38,0.65,0.48
EC42SP5ayKiYsQeZkNnau9,RUSTIC  SEVENTEEN DRAWER SIDEBOARD,22827,165.0,92.85,136.95,0.17
5oHsUwayS93UegHDkwzPxY,PARTY CONES CARNIVAL ASSORTED,22127,1.25,0.63,0.89,0.29
Ebmy8UwULpigfLsLh8vsfc,PARTY CONES CANDY ASSORTED,22128,1.25,0.34,1.1,0.12
HP8mNY7Dfk6guamyv5kx96,PICNIC BASKET WICKER SMALL,22502,5.95,2.72,3.87,0.35
SnfyKwaR7s7VNdHRhRRPco,STAR DECORATION PAINTED ZINC,22338,0.65,0.45,0.51,0.21
ZAspdKmCruyc83xDHxVNwd,RETROSPOT LAMP,22180,9.95,1.12,8.96,0.1
F8jaYJAB7PxXrFVfjzTN8U,"FANCY FONT BIRTHDAY CARD,",21506,0.42,0.08,0.16,0.62
5ELQHBi4hqV3rNzq8csa2F,HAND WARMER SCOTTY DOG DESIGN,22866,1.85,1.34,1.41,0.24
Y3xUGTb3JxM99xZoiAZ5fM,HAND WARMER OWL DESIGN,22865,1.85,0.34,1.07,0.42
GZTk22TZzoErmUywRomqoP,DOG BOWL CHASING BALL DESIGN,22349,3.75,0.49,3.08,0.18
Lpobruwje74hJCq8CDYseP,CLOTHES PEGS RETROSPOT PACK 24,22558,1.25,0.83,0.96,0.23
bRAkTpSNzp7XoTUjcKzgPQ,HAND OVER THE CHOCOLATE   SIGN,85152,2.1,1.92,1.95,0.07
23dtvU3xkSKGLYXaStGrTN,TRAVEL SEWING KIT,22652,1.65,0.33,0.35,0.79
QgGDj5TW6pFzeQKpsbuHrX,BLACK HEART CARD HOLDER,22188,3.95,2.77,2.92,0.26
jiWEvdTAR2FdcxTBWtKNem,SMALL GLASS HEART TRINKET POT,21314,2.1,1.02,1.13,0.46
czEkVEEVfMXPoAGCRcXAi8,ALARM CLOCK BAKELIKE IVORY,22730,3.75,3.5,3.52,0.06
Kf9XtEFFnkgD4rWnkPLxPh,ALARM CLOCK BAKELIKE ORANGE,22729,3.75,1.88,3.64,0.03
YtvHuMdtVzdjH37zBVmQBw,HAND WARMER BIRD DESIGN,22867,2.1,0.64,1.32,0.37
35yCQNSSvMubSzERE74sui,IVORY EMBROIDERED QUILT,22803,35.75,5.54,30.39,0.15
haF9ZFGyAdHcMYrmndk2i5,SET OF 3 BLACK FLYING DUCKS,35004B,4.65,3.53,3.72,0.2
5Xp7bjuo26oXSMMUjfoPJS,RED RETROSPOT MUG,21844,2.95,1.78,2.33,0.21
LiJUGFPiNFR7QNhHVCtQZo,BABUSHKA LIGHTS STRING OF 10,22468,6.75,3.12,5.27,0.22
jh66YQsXKWgwyoiMdV2sCT,DOORMAT FAIRY CAKE,48185,7.95,7.77,7.79,0.02
Pd4RJgtMzNiQL3hDVJ4xEC,STRAWBERRY CERAMIC TRINKET BOX,21232,1.25,0.3,0.57,0.54
3U2nKXnmoDuZi4Giv3NJVw,PINK DOUGHNUT TRINKET POT,22064,1.65,0.88,1.3,0.21
cuMqHor442Ji7RsSt9pJtE,SILK PURSE BABUSHKA PINK,22449,3.35,1.47,2.14,0.36
5cM7ekas5cQfB6daYafRsH,HOT WATER BOTTLE I AM SO POORLY,22835,4.65,2.01,3.91,0.16
FrfjxtNJ423jJgouPpP4Mm,CHOCOLATE HOT WATER BOTTLE,22112,4.95,4.8,4.8,0.03
8ZmbQMDhqSKp8uh7hpkyST,WHITE SKULL HOT WATER BOTTLE,21479,3.75,2.14,2.47,0.34
QZJCAqRSAqoRBFAhQ8ntDj,SCOTTIE DOG HOT WATER BOTTLE,22111,4.95,3.98,4.6,0.07
EkhfVZzWgbuCxTW5M8EJxV,BIRD HOUSE HOT WATER BOTTLE,22110,2.55,0.62,1.4,0.45
SqCwkrHi3up2CpF9ShFx7m,BOUDOIR SQUARE TISSUE BOX,22098,1.25,0.67,1.15,0.08
Vim8Tj8EkMixHoV9UAYpUf,SKULLS SQUARE TISSUE BOX,22100,1.25,0.99,1.23,0.02
VMeeZzrduTqZsASNRjwDge,PHOTO FRAME CORNICE,22766,2.95,0.1,2.51,0.15
jSpGguquBTfNYxjQMw5a5x,SILK PURSE BABUSHKA RED,22451,3.35,2.0,3.28,0.02
LhghV4bzG3s4pb4ByYJzCM,PICTURE DOMINOES,22549,1.45,1.09,1.12,0.23
4yxAqMYLv5YajzJb3yN85i,S/6 SEW ON CROCHET FLOWERS,84744,1.25,0.77,0.9,0.28
kvo86f25H3HtEwyySNGytD,SCANDINAVIAN REDS RIBBONS,85049E,1.25,0.74,1.21,0.03
efK6xqgLA5RRzzyz8vtLpJ,BALLOONS  WRITING SET,21328,1.65,0.76,0.82,0.5
hnzsxB2uTCtsKprhZhT5n6,LAVENDER INCENSE IN TIN,17091A,1.25,1.14,1.15,0.08
XNHZYrgsT92eft6uUF8u43,TV DINNER TRAY VINTAGE PAISLEY,22473,4.95,0.26,4.21,0.15
4zz9tkQPhNvwQKSWruChLv,SET OF 4 ENGLISH ROSE PLACEMATS,84509A,3.75,2.75,3.64,0.03
3fcBZjGiD496FqdCaBNBNn,SET OF 4 ENGLISH ROSE COASTERS,84510A,1.25,0.97,1.06,0.15
GLrnQpLHwJZkU3tJHDQiEr,TRIPLE PHOTO FRAME CORNICE,22767,9.95,9.72,9.75,0.02
55wxc8gqw4qEZZVMtcdRGW,FAMILY PHOTO FRAME CORNICE,22768,9.95,2.64,3.98,0.6
e9Ao97U2BQB2bESKWa9gz8,MIRRORED DISCO BALL,21463,5.95,4.05,5.77,0.03
WCsScYtbJq5xdZk6BanwcD,DISCO BALL ROTATOR BATTERY OPERATED,21464,4.25,1.99,3.74,0.12
ZKkfcWswfdeaPt8EExDfpY,SILVER LOOKING MIRROR,20820,4.95,0.96,1.29,0.74
L4x9sWQBYnxbuomrePpowc,LADIES & GENTLEMEN METAL SIGN,85150,2.55,0.93,2.09,0.18
9tANTWp8KEowdjZKuhAm7T,METAL SIGN HER DINNER IS SERVED,22117,2.95,1.51,1.77,0.4
CcR8Q6Sf7HNZtweek7CWdN,DOORMAT TOPIARY,48129,7.95,7.47,7.55,0.05
3iPfLTfAXPPaqSBbHAb6t9,BATHROOM METAL SIGN,82580,0.55,0.28,0.32,0.41
SeUiBsUVJBaFQSgT2Dq3J8,KITCHEN METAL SIGN,82578,0.55,0.54,0.54,0.02
BsnVnXJT23xLBU7A4un5by,TOILET METAL SIGN,82581,0.55,0.52,0.53,0.04
34NKeW3hXKc8U6HfNgaZ86,METAL SIGN TAKE IT OR LEAVE IT,22413,2.95,1.82,2.68,0.09
oT33az2rocd4Am2qBFCDA5,I'M ON HOLIDAY METAL SIGN,21907,2.1,0.41,1.85,0.12
dZndoHp57kFjDzDw9X5sap,GROW YOUR OWN BASIL IN ENAMEL MUG,22441,2.1,1.29,1.76,0.16
ABatJKMAWqUhH8W2JB2wvY,SET/10 PINK POLKADOT PARTY CANDLES,21122,1.25,0.21,0.66,0.47
VPDa3EkRpNS4L8r3SfY4MY,SET 20 NAPKINS FAIRY CAKES DESIGN,22851,0.85,0.67,0.82,0.03
2QmFyvTuDi5WJYPt2Zg9WU,SET OF 6 T-LIGHTS SNOWMEN,22810,2.95,1.42,2.42,0.18
eyt6bLuVF8KwCqAp7w4ttg,SET OF 6 T-LIGHTS SANTA,22809,2.95,2.83,2.83,0.04
H3Jve9uFhP2RX7PorNMJsV,SET OF 9 HEART SHAPED BALLOONS,22435,1.25,0.67,0.85,0.32
UpKMv994kCddj9SbEZ6RZp,SANDWICH BATH SPONGE,20966,1.25,1.21,1.23,0.02
3eid43XPSd4QKdfoXGwjJm,APPLE BATH SPONGE,20963,1.25,0.47,0.76,0.39
ZxDALi7r4C2JbqRcjNxkFR,STRAWBERRY BATH SPONGE,20961,1.25,1.05,1.19,0.05
2FFV2QbzovBxFzC9dc7N52,BLACK PIRATE TREASURE CHEST,22068,1.65,1.11,1.29,0.22
PzUeYoTg9fTSoCRjzBQkuu,STAR PORTABLE TABLE LIGHT,21743,2.95,0.35,2.48,0.16
3K8Ezbx5TcEkbuXmnhYKje,SNOWFLAKE PORTABLE TABLE LIGHT,21744,2.95,0.86,1.92,0.35
iuzr3PVaSr5ZYyJkk6Erw7,PINK OVAL JEWELLED MIRROR,84709B,5.95,0.84,1.19,0.8
34vwVi6cR4EfV2dmPrvgwt,RETROSPOT CIGAR BOX MATCHES,21592,1.25,1.14,1.23,0.02
JivuXqtQnM6Y987UN2aRYo,COSY HOUR GIANT TUBE MATCHES,21587,2.55,1.81,2.45,0.04
mGz2pvHCzzbDieHaV4tbZQ,JAZZ HEARTS PURSE NOTEBOOK,20992,0.85,0.3,0.61,0.28
FGPmJdU3WCfyeidt2nmvFd,CANDLEHOLDER PINK HANGING HEART,22804,2.95,1.56,1.95,0.34
DZfAYw5asqNW5sfEtUjbkZ,ASSORTED COLOUR MINI CASES,20749,7.95,7.22,7.23,0.09
d7Kodn84mEwBTAwuLTFVJt,LUNCH BAG SPACEBOY DESIGN,22382,1.65,0.98,1.11,0.33
DMTP3jXuY4HbGoatAB4aQc,LUNCH BAG WOODLAND,20726,1.65,0.84,0.84,0.49
ADsGsVjjkhFHRRzMbpExfe,LUNCH BAG PINK POLKADOT,22384,1.65,1.25,1.39,0.16
enyQmUMWgK3uXXZUQB5NZr,GUMBALL COAT RACK,22467,2.55,0.65,1.86,0.27
NQrM9GhoNwco97Ri9gkx7B,BLUE NEW BAROQUE CANDLESTICK CANDLE,84625C,2.95,2.12,2.27,0.23
dBKdPwsSaST95PfkErbgKE,PINK NEW BAROQUECANDLESTICK CANDLE,84625A,2.95,2.7,2.71,0.08
ZccGpye4CpVhCtDdnqozmK,FAIRY CAKE FLANNEL ASSORTED COLOUR,21108,2.55,0.3,0.59,0.77
bcV9kJYchjc9HmwBQqYeUC,BREAD BIN DINER STYLE PINK,22848,16.95,9.8,12.37,0.27
LpLnjFMeXmmJswEKXUu23C,TEA TIME TABLE CLOTH,47570B,10.65,2.39,6.07,0.43
YBkPx3ugujVatie3JR3pKH,HOT WATER BOTTLE BABUSHKA,22837,4.25,0.81,3.65,0.14
jtaNf2ZXiPE2JiP8jk3NjM,HEART IVORY TRELLIS SMALL,22297,1.25,0.75,1.01,0.19
kAkUv2PxzsCNqY4wXvHjjw,PINK DRAWER KNOB ACRYLIC EDWARDIAN,22772,1.25,0.37,0.57,0.54
BSGwR5hLhosdDzskYUWJUn,GREEN DRAWER KNOB ACRYLIC EDWARDIAN,22773,1.25,0.32,0.99,0.21
Z5BosJXhSAHKkx7dufQb7H,BLUE DRAWER KNOB ACRYLIC EDWARDIAN,22805,1.25,0.09,0.79,0.37
3AgmH9v6oECL3iWp7U3NNw,SET 6 FOOTBALL CELEBRATION CANDLES,21125,1.25,0.78,1.15,0.08
ntnhZnCdfv6qy8oKjV3V5x,SET OF 6 GIRLS CELEBRATION CANDLES,21126,1.25,0.12,1.16,0.07
BtwQRs9wcGENeD6UFsujVR,ROMANTIC PINKS RIBBONS,85049C,1.25,0.91,1.16,0.07
XmS2jd3UN8DBPbFKNb7T4m,BRIGHT BLUES RIBBONS,85049D,1.25,0.35,0.38,0.7
ZUahpYWTwweFxrnYZDpopJ,CHOCOLATE BOX RIBBONS,85049G,1.25,0.4,0.56,0.55
nqDqAG75bpMqpFA6PgCWPX,PARTY INVITES FOOTBALL,21061,0.85,0.39,0.8,0.06
HSS3mRLm9bt7AnajvHxNbc,PARTY INVITES JAZZ HEARTS,21063,0.85,0.47,0.51,0.4
FcgV5LvGiNcysPdKadsHLd,PARTY INVITES SPACEMAN,21062,0.85,0.62,0.71,0.17
kHMYboxDq68pTyvA5nDbmr,SET OF 3 BUTTERFLY COOKIE CUTTERS,84380,1.25,0.85,1.0,0.2
3tTbT4AYVUJyJD3D562xkY,SET OF 3 HEART COOKIE CUTTERS,84378,1.25,0.96,1.14,0.09
7n785XZfUwWYqiBxLYCdvJ,3 PIECE SPACEBOY COOKIE CUTTER SET,22964,2.1,0.56,1.6,0.24
2FWPwreFuxTrGX7P7gcPUc,PACK OF 72 SKULL CAKE CASES,21213,0.55,0.27,0.36,0.34
CheAViKoavSdYkbjXSXPoM,PACK OF 60 SPACEBOY CAKE CASES,22417,0.55,0.47,0.51,0.08
YydgBaarSQSToprn7GLNwR,72 SWEETHEART FAIRY CAKE CASES,84992,0.55,0.19,0.21,0.62
bKSchaiJg5qcXzr5jQUgQd,LUNCH BAG SUKI  DESIGN,22383,1.65,0.45,1.6,0.03
CoV7Bwx8PowjLCCNbSGBZM,LUNCH BAG CARS BLUE,20728,1.65,1.07,1.6,0.03
cWKPdEQQdGg7ECoTHrueRt,LUNCH BAG  BLACK SKULL.,20727,1.65,0.39,0.53,0.68
29PdeNqeus7nCAjAEMkvyg,HEART IVORY TRELLIS LARGE,22296,1.65,0.66,0.86,0.48
G6FAj4Uew8EEQzZrzcPzzi,SET/5 RED RETROSPOT LID GLASS BOWLS,20914,2.55,0.56,0.94,0.63
nVaaKFRBtPTa99jRV68aWp,MAGIC DRAWING SLATE DINOSAUR,22537,0.42,0.11,0.16,0.61
7eNhmqmpVn7iYrTkxZV97X,MAGIC DRAWING SLATE BAKE A CAKE,22533,0.42,0.17,0.39,0.08
Fw786dxAXsqKwp3w32od7V,12 PENCILS TALL TUBE SKULLS,20982,0.85,0.45,0.51,0.4
X9xPhRBvg32yuMBq9v4H2j,RED  HARMONICA IN BOX,21915,1.25,1.12,1.23,0.02
4bjAJefVMoRq6UvXEppVjE,BLUE HARMONICA IN BOX,21914,1.25,0.49,0.91,0.27
f2rQo6gzteerxCKuKzoS24,SKULLS  WATER TRANSFER TATTOOS,21544,0.85,0.83,0.83,0.02
HCDJ4BDZy9LDw8pkfNsSS5,PACK 3 BOXES BIRD PANNETONE,22813,1.95,0.1,0.84,0.57
AEKwZFnSKmFgN39ocWLKt2,SET OF 20 KIDS COOKIE CUTTERS,84375,2.1,1.2,1.7,0.19
abhc4QaUP6oL4oZLCjFnmp,10 COLOUR SPACEBOY PEN,22418,0.85,0.13,0.27,0.68
bnjT63TPrLqsyfiwzBPuxn,VICTORIAN GLASS HANGING T-LIGHT,22178,1.25,0.27,0.79,0.37
Jx8gTRtfNxg2pJ9UBRWWoh,SINGLE HEART ZINC T-LIGHT HOLDER,84970L,0.95,0.14,0.44,0.54
927YwW7G8qLXoqchy4D4Hm,HANGING METAL STAR LANTERN,22465,1.65,0.57,1.17,0.29
RJyyapWTYmBjE6fEzsaWmh,SILVER HANGING T-LIGHT HOLDER,84949,1.65,0.33,1.29,0.22
T743HGCTfhwZnZZtpwXHiT,DOORMAT RED RETROSPOT,20685,7.95,4.5,5.17,0.35
MJXXomPyaUc2r7VCy6a6AC,DOORMAT HEARTS,48194,7.95,5.82,7.23,0.09
ByCD7n8YkP8HECzuAa63cj,NATURAL SLATE RECTANGLE CHALKBOARD,22488,1.65,1.37,1.39,0.16
8T8MXhR39xi4QbVeVZN3oA,LOVEBIRD HANGING DECORATION WHITE,22219,0.85,0.38,0.78,0.08
ULZMLdSSVDRRR493yoN72q,PENS ASSORTED FUNNY FACE,22610,0.85,0.1,0.65,0.23
TyTH4VJ7fkZaBjJSwfds5y,CARD CIRCUS PARADE,22716,0.42,0.31,0.37,0.12
bqqq26ZcRMkEy9N5dACKDe,WRAP COWBOYS,22706,0.42,0.32,0.36,0.15
7s7eDTjBC5iqZNECSMQUrK,AIRLINE BAG VINTAGE TOKYO 78,22371,4.25,2.86,3.36,0.21
TR7BWJJoN4RfYQLyiEBFbc,SET OF 72 RETROSPOT PAPER  DOILIES,21210,1.45,0.89,1.41,0.03
6bQ3WYJjwkttBM7amEtPrV,SLEEPING CAT ERASERS,16237,0.21,0.1,0.11,0.46
RqpcJ9B7FZ2x8woPmP8wxT,CARD BIRTHDAY COWBOY,22714,0.42,0.37,0.38,0.1
5pu9thoufd2mSGQza4ATfS,PACK 3 BOXES CHRISTMAS PANNETONE,22812,1.95,0.31,1.11,0.43
hs9DxXacmLHLQMcpHQYdk7,ROTATING SILVER ANGELS T-LIGHT HLDR,84347,2.55,2.27,2.37,0.07
kpzhPpoUfRhM8tL7RamwSA,RIBBON REEL MAKING SNOWMEN,22736,1.65,0.31,0.58,0.65
c6Cgq45jF4D8TXnW8hqMqA,4 TRADITIONAL SPINNING TOPS,22620,1.25,0.35,0.8,0.36
ZZZsfskFwLcB7wvYfyUEFo,BAG 500g SWIRLY MARBLES,21705,1.65,0.72,0.97,0.41
WcKxMvTeybzDuGohG8gV7g,5 STRAND GLASS NECKLACE CRYSTAL,90199C,6.35,1.21,3.05,0.52
c8YyDvDi3m7rRFrRdKEQ3V,SQUARECUSHION COVER PINK UNION FLAG,22785,6.75,5.01,5.33,0.21
VyeAm3iJjJCxYiZ6KoTydv,SPACEBOY CHILDRENS EGG CUP,22975,1.25,0.93,1.05,0.16
Z6xr8M4MtKrWmiedumDeZD,CHILDREN'S SPACEBOY MUG,22972,1.65,0.75,1.14,0.31
Ug6Q9PgCA4YYimB8uapWna,FELTCRAFT CUSHION OWL,22568,3.75,3.63,3.64,0.03
ZVXRPNQwntP3GHtjbxQMXc,BLACK CANDELABRA T-LIGHT HOLDER,85116,2.1,0.85,1.72,0.18
d9cPhUySfZrZWGPVTieEDC,TOY TIDY DOLLY GIRL DESIGN,22664,2.1,2.1,2.1,0.0
9aqe7ZgKoHEvPmrCgxSUe8,SET 12 LAVENDER  BOTANICAL T-LIGHTS,21609,2.95,0.36,0.83,0.72
UmY2z4tya7rsB9Yo6g5gHf,UNION JACK FLAG LUGGAGE TAG,21866,1.25,0.88,1.01,0.19
auW8yWog8gq7Gjowhv47uq,RED HEART LUGGAGE TAG,20669,1.25,0.58,1.05,0.16
ZQakrC7nrxbmozpBYhzxZF,RED GLASS TASSLE BAG CHARM,90129F,2.95,1.38,1.89,0.36
ZxASnbhDQwfYpe2y2QEnwX,CLEAR ACRYLIC FACETED BANGLE,90210B,2.95,1.23,2.8,0.05
TVAgPC9pztdRQ6HbiB26H5,DOORMAT UNION JACK GUNS AND ROSES,21955,7.95,4.45,6.2,0.22
fDaV2a5XTdxm5kmPRnNhAQ,VANILLA SCENT CANDLE JEWELLED BOX,72802C,4.25,0.5,0.89,0.79
ErDReQD9C8gZLd6FraE9rh,FULL ENGLISH BREAKFAST PLATE,22109,3.75,3.73,3.67,0.02
