id,Description,StockCode,UnitPrice,ProfitMargin,DiscountedPrice,DiscountPct
WGoZNKcSstM4EQWDUqhSMo,WHITE ROSEBUD  PEARL EARRINGS,90165B,2.54,0.44,1.93,0.24
5tASke32vR7SoSEbuYpxHF,FLORAL PINK MONSTER,20694,7.62,2.3,3.58,0.53
WfScw6MsY9MQxD5tZqRcW4,GOLD FABRIC MIRROR,20869,1.28,0.43,0.46,0.64
HQYvx7LSjWppYnHaWkDCGC,*USB Office Mirror Ball,20954,8.47,7.91,7.96,0.06
DYZTjWXP4jJB5bSPTVQjdJ,PAINTED YELLOW WOODEN DAISY,21455,1.66,1.25,1.46,0.12
NGUFakCQchprLBVi4ti87z,"MUG , DOTCOMGIFTSHOP.COM",22206,0.85,0.33,0.56,0.34
kKepaGCR3pjhAav5DcizpV,PINK STOCKING CHRISTMAS DECORATION,35933,4.21,1.09,1.98,0.53
Y66AUxVgBBYjAP2PwBokBS,SET/3 POLKADOT STACKING TINS,85232A,10.17,3.45,9.05,0.11
EPz8rjtUM4xruhKF38sXor,GLASS BEAD HOOP EARRINGS MONTANA,90027B,2.96,1.19,1.98,0.33
9PLueWvtPuZEcKKxb8QgZT,PINK CRYSTAL+GLASS BRACELET,90122A,5.09,4.5,4.73,0.07
7gqDbTBmX2A7pas4etSa3v,BLACK GLASS BRACELET W HEART CHARMS,90197B,5.09,1.2,4.84,0.05
Wqk2tChDvjLHkWSzmnxwQD,LAVENDER SCENT CAKE CANDLE,72225C,0.29,0.05,0.2,0.3
iNNnovQm9392hPWBpVm48V,POLYESTER FILLER PAD 30CMx30CM,46000U,1.25,0.12,1.1,0.12
FXVYWgpaDG9fTxA8tfAg8y,RUBY DROP CHANDELIER EARRINGS,90072,4.24,3.25,3.9,0.08
Q6UtVAj5oHC34wvBrwoQRH,"LETTER ""T"" BLING KEY RING",90214T,0.85,0.06,0.48,0.44
FuBxhpKfFarWpsAdGNFJuY,SET/3 POT PLANT CANDLES,20934,11.02,6.98,9.59,0.13
ksDjNRZbyAWmgJy5dhLviT,RED  EGG  SPOON,21402,0.85,0.53,0.54,0.37
SNxg7xH4wPZHnzisnxXzKZ,PINK FAIRY CAKE CUSHION COVER,47585A,10.17,2.27,8.03,0.21
H2TBvQay6fz3DRj83K4zmB,PURPLE CRYSTAL DROP EARRINGS,90011D,2.96,2.93,2.9,0.02
75sM6xV2zsSgkkx8sAiPFB,MIDNIGHT BLUE DROP CRYSTAL NECKLACE,90012A,10.2,1.09,6.83,0.33
Wee47Akdt5rhJACi7cUzD8,FRESHWATER PEARL BRACELET IVORY,90042C,2.54,0.43,2.39,0.06
oFek2ZLsc9BFEK5uxRjThg,TURQ PENDANT TRIPLE SHELL NECKLACE,90141C,5.51,3.27,5.23,0.05
7zR7YzoA2a63Y96RSu5vWy,GREEN PENDANT SHELL NECKLACE,90142A,5.09,2.51,3.82,0.25
XLjbMVZuj3oqYFhoGBVppW,PINK ROSEBUD PEARL EARRINGS,90165A,2.54,0.8,1.91,0.25
QCuKZZuEdRd79XJtRXpbKy,DROP DIAMANTE EARRINGS BLACK DIAMON,90177B,2.96,2.64,2.84,0.04
JQE5gdA2jEbZmjUtMuJv6N,PINK ENAMEL FLOWER HAIR TIE,90202D,2.96,2.56,2.84,0.04
ZX8S9hRtRHsKGEqSuEDUkb,LAZER CUT NECKLACE W PASTEL BEADS,90154,8.95,1.31,5.19,0.42
NisxkgMuLuWsJf8i5T4MGr,5 STRAND GLASS NECKLACE AMBER,90199D,6.35,1.61,3.37,0.47
ZtZWKuvbeuLxUoXRAQGuNx,SILVER/MOP ORBIT NECKLACE,90014A,9.95,6.97,9.15,0.08
VDPtxqw6ADpefk9BHdewCj,PURPLE CHUNKY GLASS+BEAD NECKLACE,90178B,11.95,2.77,3.82,0.68
Anbm4bsoXqf2VAgw7oNhVT,ETCHED GLASS STAR TREE DECORATION,21009,1.25,1.24,1.23,0.02
Qssod8LsyoM4LUqUAh7iXK,CLASSIC FRENCH STYLE BASKET BROWN,21793,6.75,6.51,6.55,0.03
Wsdpc77erS6dsPqGeAkQrg,EAU DE NILE JEWELLED PHOTOFRAME,85023B,2.55,1.72,2.04,0.2
EMcgB7N67VgdjinsyTRjME,PINK BOUDOIR T-LIGHT HOLDER,85109,0.85,0.17,0.81,0.05
dSa6X6KMrDCzuryEifgqTA,CREAM DELPHINIUM ARTIFICIAL FLOWER,84804A,2.95,1.27,1.39,0.53
XdUVeuy27AhS7UmbwQRohd,LARGE WHITE/PINK ROSE ART FLOWER,84800L,2.12,0.47,1.46,0.31
52Pr8hWckKeeLyiGVHW73e,MEDIUM WHITE/PINK ROSE ART FLOWER,84800M,1.69,1.64,1.66,0.02
fcaVsBGooexwdUQ6mzcySF,WHITE ANEMONE ARTIFICIAL FLOWER,84802A,1.69,0.05,1.57,0.07
UwaguryE8fXQ7Eq7jGJ5Ja,PINK CANDYSTUFT ARTIFICIAL FLOWER,84806A,1.45,1.03,1.32,0.09
XoEbt7rmtsaPGQ4kuymugx,WRAP MONSTER FUN,22707,0.42,0.08,0.12,0.71
5dKnunLS5oRy3wbXYQ6y97,TOYBOX  WRAP,21503,0.42,0.11,0.11,0.74
RLfjBA9GUP9FRafuKkdedx,BLUE BLOSSOM HAIR CLIP,90108,1.05,0.38,0.84,0.2
3diG6Fi998PKPf7BHP2sMm,PINK STRAWBERRY HANDBAG,16207A,2.95,0.28,1.95,0.34
CsuW2au4EhfsLSLNMVBKP7,SMALL SKULL WINDMILL,21747,1.25,1.0,1.01,0.19
WTtrUzCGAkETXwX3fpK8L3,SET/3 RABBITS FLOWER SKIPPPING ROPE,84457,0.85,0.73,0.77,0.1
b75rU56hEsiCzLy7JzaxhD,"GREETING CARD,SQUARE, DOUGHNUTS",84249A,0.42,0.15,0.24,0.44
7VDRWvkH6gF3ki2Vj5LGpF,EASTER CRAFT 4 CHICKS,22148,4.21,2.78,3.28,0.22
byShtjKu5rhTYpWzLL4cxr,BLACK CRYSTAL DROP EARRINGS,90011B,2.96,1.38,2.66,0.1
A2k6zfpYiTiGvjyXatnUTP,CRACKED GLAZE EARRINGS BROWN,90055,2.54,1.35,2.08,0.18
ZgzgRUckJfyN6he3cHz5uS,MOP PENDANT SHELL NECKLACE,90142D,5.09,3.94,4.12,0.19
dvAPCzzM763frv6Yw9EHtK,DIAMANTE NECKLACE BLACK,90176B,7.64,2.64,4.66,0.39
FZfpkLys2QPiz9iid3m8rX,WHITE HEART CONFETTI IN TUBE,21198,0.42,0.05,0.24,0.43
jqZLxQum5MPvhbzx6kbFHM,GLASS BEAD HOOP EARRINGS AMETHYST,90027D,2.95,0.98,1.42,0.52
TtH7ahbyyAGfxrtkzaXP43,CANNABIS LEAF BEAD CURTAIN,44228,0.85,0.2,0.48,0.44
JecxtqXeaYfVw6kDExFDCR,OPIUM SCENTED VOTIVE CANDLE,85230A,0.21,0.06,0.19,0.11
GKSF7JBf2FmK9UGf4zz4NC,RETRO PLASTIC DAISY TRAY,79191D,1.66,0.27,0.35,0.79
2tqWoUoCtywHnWk7m3HmH5,LOVE HEART TRINKET POT,22066,1.45,1.21,1.3,0.1
CjNyweNbWNZYGDRRWsebcb,"ACRYLIC HANGING JEWEL,BLUE",35819B,2.51,1.14,1.25,0.5
Z8LzhuDepDbbccAaJu7p4G,GLOW IN DARK DOLPHINS,84199,0.21,0.07,0.13,0.38
ebyCrrP6aMvyTu2S89zuHf,"METAL SIGN,CUPCAKE SINGLE HOOK",82613A,1.25,0.1,0.86,0.31
emtXmeuX3DQVRTjcNHt9EB,YELLOW DRAGONFLY HELICOPTER,85135A,7.95,4.72,6.92,0.13
bQwPLruC3R5TuGWCTDmkSf,CHEST NATURAL WOOD 20 DRAWERS,22823,125.0,110.61,115.0,0.08
VUnNVLmKgKRrd3Hhib72gn,PINK PAPER PARASOL,15044A,2.95,0.84,2.33,0.21
HS4xEqgtFPV68vsXWobpZa,CINAMMON SET OF 9 T-LIGHTS,85231b,1.66,1.13,1.23,0.26
ZXmLDJtRZufnTa2NRdgtpw,IVORY ENCHANTED FOREST PLACEMAT,85114b,3.36,2.63,3.29,0.02
7c5t7Zu2rSjWigtXLVYmTf,WHITE BIRD GARDEN DESIGN MUG,85160a,16.13,9.15,10.48,0.35
n4TuDX2uw9TPKizboXfRnG,"METAL SIGN,CUPCAKE SINGLE HOOK",82613b,2.51,1.81,2.16,0.14
nFYGpmRRzbRZrxz9q6t9hn,"METAL SIGN,CUPCAKE SINGLE HOOK",82613c,2.51,0.66,0.68,0.73
6VYQwPBA6P3jKDZU4nx54W,SUNSET CHECK HAMMOCK,84795b,16.98,10.38,14.94,0.12
Wf3FrBG7bcyxrhCAVMnjMP,LARGE ROUND CUTGLASS CANDLESTICK,85126,13.57,3.26,9.5,0.3
inK8EoKvuqYTrtjvQ2m7ez,ICON PLACEMAT POP ART ELVIS,47518f,4.21,0.6,3.16,0.25
EGhimaWb9ZFPTJ9WruVW7M,CHOCOLATE 3 WICK MORRIS BOX CANDLE,85035b,8.47,4.02,4.66,0.45
YSsycuH2SFiSHXBDAL9C8k,SET OF 16 VINTAGE SKY BLUE CUTLERY,84968f,25.49,24.2,24.73,0.03
Avrb4vk4sLStqGe8vvhS2w,CHOCOLATE BOX RIBBONS,85049g,2.51,2.16,2.16,0.14
TcYNDbJ5fApYQ6KqJqVcP9,BLACK FLOWER CANDLE PLATE,84499,0.85,0.55,0.72,0.15
RzUSsmaPaQTjFRHmGrhGsf,POPART WOODEN PENCILS ASST,16045,0.12,0.1,0.1,0.13
nS7sHA4bPisiqaz4xj6P4S,RED POLKADOT BEAKER,21394,1.95,0.24,1.75,0.1
TtHJh4AsbqkSs72U8nZNGt,TEA PARTY  WRAPPING PAPER,22046,0.42,0.02,0.08,0.8
W2vauPP3SQuoULHncUqCzA,BLUE SCOTTIE DOG W FLOWER PATTERN,84931B,1.66,1.5,1.58,0.05
4fTZjkkxPK32yF92KvyJ5b,ANTIQUE CREAM CUTLERY CUPBOARD,21270,8.47,1.15,5.76,0.32
Yju5zHyHokYAW5mX8Ymfog,ACRYLIC GEOMETRIC LAMP,85161,12.72,5.87,6.87,0.46
VBeS67jbTy6qZmAybMMQrk,MIDNIGHT BLUE CRYSTAL DROP EARRINGS,90011A,2.96,2.08,2.34,0.21
ZEgARxxycygMhpi4FETJPK,PURPLE VINTAGE EARRINGS,90013D,4.24,2.31,3.86,0.09
RFgm3N6cBCMhmoBr8mjiAf,NEW BAROQUE B'FLY NECKLACE MONTANA,90024E,8.49,2.18,5.94,0.3
54kxBSGAyvpkiibGa79jKX,NEW BAROQUE B'FLY NECKLACE CRYSTAL,90024F,8.49,0.68,8.15,0.04
T8Se6qKPDfUA242tpVN7xA,PURPLE FRANGIPANI NECKLACE,90103,2.54,1.48,1.63,0.36
d93akZqV5fTccXNz7Nsn3S,SILVER/NAT SHELL NECKLACE W PENDANT,90152A,5.51,3.24,3.8,0.31
ntnCgTnDtz4KTcaWD6zkcw,LARGE CRYSTAL DIAMANTE HAIRSLIDE,90205C,1.69,0.22,0.9,0.47
MPrDb9bmBaasi6iP4ntrxe,BUNNY DECORATION MAGIC GARDEN,22247,0.81,0.48,0.75,0.07
bGHsx7b8G385XnmBDWPgKF,"GREETING CARD, TWO SISTERS.",84251C,0.43,0.01,0.18,0.57
3xYDHjSAJegvJqByoqajWx,RED PURSE WITH PINK HEART,16206B,1.25,0.33,0.79,0.37
7deT2HvHB6J4zG3iqKjJ4B,BLUE CHENILLE SHAGGY CUSHION COVER,46138B,1.95,1.81,1.81,0.07
eMzn36DoLfQg2wRsaVcGQX,PINK CAT FLORAL CUSHION COVER,20701,3.75,3.58,3.64,0.03
J6cArfYt4fAijxqoNZhM2p,PINK DOLLY HAIR CLIPS,90112,1.05,0.71,1.02,0.03
ESZCvb6T4ztsfsHoHJvefC,RASTA IN BATH W SPLIFF ASHTRAY,35443,0.85,0.54,0.68,0.2
KgXkJSxcdhRbkgYyzuGsxu,VINTAGE GLASS TEA CADDY,21661,5.95,1.1,4.64,0.22
63hDq2AgdCGdFLkkucraet,AMBER BERTIE GLASS BEAD BAG CHARM,90125E,1.66,0.49,0.81,0.51
CpaW9npgvTKZNaQeav9925,BLACK BAROQUE CARRIAGE CLOCK,85168B,8.47,4.4,5.0,0.41
4aoKuDpKbrXtHg46s4ZwKv,BUNNY EGG GARLAND,85186C,0.85,0.85,0.84,0.01
bHBmSpQYAy4HRocnhroFEf,FLOWERS TILE COASTER,84926E,0.42,0.11,0.19,0.55
B98iKgbCcNymFqmTMNctzy,BOX/12 CHICK & EGG IN BASKET,84218,1.95,0.06,0.25,0.87
TfP6DkpQoehMfC7RehAuiD,HANGING SPRING FLOWER EGG SMALL,85194S,0.65,0.6,0.6,0.07
o5ZoqSdfuiJETTMTp3LWud,EASTER DECORATION SITTING BUNNY,22268,1.66,0.47,1.44,0.13
B3qgFFc3XhUFTKK8HqpVUv,TINY CRYSTAL BRACELET GREEN,90037B,2.54,1.87,1.96,0.23
9MfSduckKzUbnnXejh3XEc,PEARL AND CHERRY QUARTZ BRACLET,90041,3.81,2.65,2.93,0.23
6qEJeHCefHXh39tg3A4VcC,TURQUOISE BERTIE GLASS BEAD CHARM,90125C,1.66,1.39,1.43,0.14
FWsD9Govt2b9P8gzGcbX8r,PINK ROSEBUD & PEARL NECKLACE,90163A,7.64,5.34,5.73,0.25
RAc7Dc5Pd32wu6jLUUNVew,WHITE ROSEBUD & PEARL NECKLACE,90163B,7.64,0.3,1.15,0.85
ajMoBCo42fqCg52NhFQLwz,VINTAGE GOLD TINSEL REEL,21412,0.42,0.23,0.4,0.04
VovtLQPp5jaRurvejW55nh,PINK/FLOWER RABBIT EGG WARMER,35911B,2.1,1.91,2.02,0.04
2fD9VBqNhvCU8x3LsmNwoW,75 GREEN FAIRY CAKE CASES,84989A,0.55,0.44,0.51,0.07
ZLHwzyxbwCq4GKmaZNmNi4,ENGLISH ROSE METAL WASTE BIN,79071B,2.95,1.06,1.56,0.47
iF3FMKayUTUTAGaZawmedd,WRAP DAISY CARPET,16169M,0.42,0.4,0.4,0.04
kin7Z38Qw9YcC3PJC5Bmcs,WRAP WEDDING DAY,22709,0.42,0.33,0.34,0.2
LnAGDu7Pi965oXZgP86cnD,FLAMINGO LIGHTS,79320,4.95,4.55,4.55,0.08
PHvANXyh6wWQxhA64DbWJe,ANTIQUE LILY FAIRY LIGHTS,85042,4.95,3.65,3.96,0.2
3buxgqxKDtG3483Q4bmhYf,FUSCHIA RETRO BAR STOOL,20785,39.95,24.6,33.96,0.15
hgQCPxwkXmxBADsRz7HKGc,CANDY SPOT BUNNY,85089,2.95,2.68,2.8,0.05
Caut8fkSVSb6XQiq5M7xS9,RABBIT EASTER DECORATION,35909A,2.95,2.02,2.48,0.16
Bqfv8GHj54e5ZYUcBGF3Sy,MULTICOLOUR EASTER RABBIT,35910A,1.95,1.03,1.87,0.04
33d6NVAEGDMFAZ3UwDUYJQ,VINTAGE WOODEN BAR STOOL,21763,29.95,16.8,20.37,0.32
2qAe6qvJzEJqNKLWzaQaAv,YELLOW POT PLANT CANDLE,20933,3.75,3.38,3.38,0.1
bi84zYoifCqu7q5aJfSc4k,DAISY FOLKART HEART DECORATION,35972,1.25,0.69,0.71,0.43
RSWdPt7qPGkNi7CmkXrW82,RESIN NECKLACE W PASTEL BEADS,90155,7.64,6.16,6.19,0.19
8ye25eQt2sYNd5p7TW36LX,CONGRATULATIONS BUNTING,47589,5.45,1.07,2.62,0.52
Wbytm9qZLux75nt6qmjP9P,BLACK CHERRY LIGHTS,79323B,6.75,2.37,5.67,0.16
ZznRZ89VwcSF5QpHNSmgsN,ASSORTED TUTTI FRUTTI ROUND BOX,21645,1.65,1.06,1.39,0.16
NmXAWpPhpfpaE4wKe2xJ5h,WHITE SQUARE TABLE CLOCK,84661A,2.51,1.27,1.36,0.46
m43L7RD8Yggu5tywRrrGQV,PINK DAISY BAG CHARM,90118,2.51,0.62,1.83,0.27
LuicuLXDQkTehky95hnYe4,BLACK 3 BEAD DROP EARRINGS,90182C,2.96,2.37,2.4,0.19
U4i7vvcwArbBWL24P5YcYP,VINTAGE KITCHEN PRINT PUDDINGS,21278,2.55,1.01,1.1,0.57
GJXprVwSNpty2x9v62puzR,ICON PLACEMAT POP ART ELVIS,47518F,0.42,0.35,0.38,0.09
VYfz5GuncSRVLiBEZwW2xa,"WRAP, CAROUSEL",16156L,0.42,0.33,0.38,0.09
HtTcnAPchUWemkSYPp2d2r,BLUE  VOILE LAMPSHADE,47351B,2.95,1.8,2.06,0.3
dU8W7JzkaEzarf25J5voAb,SET/6 COLLAGE PAPER CUPS,21084,0.65,0.57,0.58,0.11
Mdkqv7om8VmK6AS38WcXws,SET/6 FRUIT SALAD PAPER CUPS,21088,0.65,0.25,0.34,0.48
HyYpE5Gk49JDhgaLhefEbj,SET/6 FRUIT SALAD  PAPER PLATES,21096,0.85,0.65,0.83,0.02
YDs3hh6xgRFkrw3GfdiZ5T,METALIC LEAVES BAG CHARMS,90119,2.51,2.09,2.13,0.15
ajbAGwCCedKQBKaBMAqh8z,CITRUS GARLAND FELT FLOWERS,84741C,1.95,1.62,1.77,0.09
fvf9fxbknDCanaAYDHUMP2,EASTER DECORATION HANGING BUNNY,22266,0.65,0.44,0.45,0.31
NrvX7dA6ArcHpZLUViVg5r,EASTER DECORATION EGG BUNNY,22267,1.25,0.91,1.17,0.06
2LN42rn8eVgL4kyT2nxzsM,ROSE DU SUD CUSHION COVER,21003,6.35,0.5,3.49,0.45
X3yN6imT7kQtdnpHatfRjB,LIGHTHOUSE PRINTED METAL SIGN,21757,4.95,3.13,4.06,0.18
cMwpHbfGv67KDwGTnfhgeZ,TURQUOISE HEART OF GLASS BRACELET,90123B,5.95,3.85,4.76,0.2
dmMtY2bdxAyf53r9pnPyK3,GREEN HEART OF GLASS BRACELET,90123C,5.95,2.33,4.17,0.3
TCheQAHkDVmuzRTqvvzqSc,TURQUOISE CRYSTAL+GLASS BRACELET,90122C,4.95,1.96,2.97,0.4
9L2w9sB9xWZVzAqY5aKNsN,RESIN BRACELET W PASTEL BEADS,90156,4.95,2.12,2.13,0.57
jVJKThKVbrK5raZrgr3RRt,PINK LARGE JEWELED PHOTOFRAME,85023C,2.55,0.41,0.48,0.81
DzzPMsxQJ22A2neZZdRCij,NEW BAROQUE BLACK BOXES,84617,12.75,12.21,12.24,0.04
8bGmuAKV9i9TZkgnmoSG6n,MOROCCAN BEATEN METAL MIRROR,21332,12.75,7.11,7.78,0.39
BacYhgKZtN25iDU5Qe9czz,CANDY HEART HANGING DECORATION,35923,2.51,1.87,2.38,0.05
6QrebcaX9srvt3LoHfNZAR,PINK SQUARE TABLE CLOCK,84661C,2.51,1.26,2.33,0.07
MdFH3okWap5YT56GQZmGhM,GLASS AND PAINTED BEADS BRACELET OL,90038B,3.81,1.65,2.36,0.38
9gREm7JDqm955EAWPXaniM,PINK COMBO MINI CRYSTALS NECKLACE,90137,5.51,5.4,5.4,0.02
UqQP5nHzrDeee7F72fkkX5,HANGING RIDGE GLASS T-LIGHT HOLDER,21655,1.69,0.25,0.54,0.68
B6S8dzHKKqPnFazyrHUq4C,PINK CHERRY LIGHTS,79323P,6.75,4.4,4.86,0.28
nXMX2rzUffRxxvTxdnA4VW,AMBER GLASS/SHELL/PEARL NECKLACE,90181A,9.34,0.43,6.35,0.32
SB6wsGMDjEtE8PYEszbVfy,"LETTER ""W"" BLING KEY RING",90214W,0.85,0.25,0.56,0.34
nxKxSHYmaoVHV6FLdp2wwq,DIAMANTE HAIR GRIP PACK/2 LT ROSE,90059F,1.69,1.48,1.52,0.1
8MWgGHmuqCXVEKhoXohpxE,BLUE CRUSOE CHECK LAMPSHADE,44091A,0.42,0.36,0.37,0.11
MjHNhEFdH9TvvPTpdQMay2,VINTAGE KITCHEN PRINT VEGETABLES,21280,2.55,1.44,1.5,0.41
dBVMnoAhJkfBjZNH3i3N3V,TINY CRYSTAL BRACELET BLUE,90037C,2.54,1.83,2.08,0.18
dmBTeLr7rfVArq9nsRgJwE,JADE CRYSTAL+GLASS BRACELET,90122B,5.09,1.47,4.68,0.08
D7sY5MFPXevmdc7hCQCVkY,PEACH KNITTED HEN,35915C,3.36,1.8,2.49,0.26
2mqJ6jnm4Sbv7zkpkRDsfc,SET OF 12 MINI BUNNIES IN A BUCKET,85197,2.1,1.74,1.85,0.12
LhzpqxWDiEoxF5CVaY4ryi,BLOSSOM  IMAGES NOTEBOOK SET,85019B,4.25,3.76,3.95,0.07
gjfZNpoHjpafQUmbqVhBdY,PINK HEART RED HANDBAG,16207B,2.95,0.65,0.97,0.67
TUi2XGX6FRz3VzNDjzvZzB,LITTLE PINK MONSTER SOFT TOY,20698,2.55,0.32,0.51,0.8
LW5xNoNVpnELzKDXgBS9KM,TEA TIME TEA TOWELS,47556B,2.55,1.62,2.22,0.13
Qv4tJXnC7UAZB3JFuiYGGZ,COLOURFUL FLOWER FRUIT BOWL,35265,6.95,0.97,6.6,0.05
9sJNCMXmPTMgvojkWZsbqC,THE KING GIFT BAG,16162L,0.65,0.6,0.64,0.02
FTkGhJ6grHWhk5EqDinHao,BLUE CRYSTAL BOOT PHONE CHARM,90092,1.66,0.84,1.28,0.23
oMsJzSnvLyv38VQb9vddsM,SILVER/CRYSTAL DROP EARRINGS W LEAF,90190A,2.96,1.85,2.52,0.15
3yeFAitGz438CfgMRTTwWw,AMBER CRYSTAL DROP EARRINGS,90011E,2.96,0.41,2.78,0.06
6YLb6qSxMrQyyJxrzB4DYb,GLASS AND PAINTED BEADS BRACELET TO,90038A,3.81,0.67,2.36,0.38
UoNw5KUHqzU3yW6rni2oBw,VINTAGE ENAMEL & CRYSTAL NECKLACE,90079,5.09,2.09,2.65,0.48
iLbBYdV7SzVcsmCcLdzcLC,GLASS CAKE COVER AND PLATE,21667,14.95,13.5,14.35,0.04
5VbTMgBZoC5pEb7VsqxUnX,PINK POLKADOT KIDS BAG,22323,1.95,0.22,0.66,0.66
bqSJUJ2MnGj2mdUrcBvHho,MIRROR MOSAIC T-LIGHT HOLDER ROUND,22103,1.65,0.68,1.53,0.07
43369aEkvR778hx6U3bpEy,ROSE PENDANT TRIPLE SHELL NECKLACE,90141D,5.51,4.24,5.23,0.05
RRCPyQrDBBCbdMHW7f7vV9,BLACK BIRD GARDEN DESIGN MUG,85160B,16.13,2.41,14.52,0.1
EppHCASY5BVXJqomeDkgMG,WRAP DOILEY DESIGN,23231,0.42,0.24,0.26,0.39
2sZW4h9jDjq7cpLk42HFsj,PINK RETRO BIG FLOWER BAG,62086A,1.95,1.19,1.38,0.29
jUbAGspx7Lu88n2vg8zkLw,FIRE POLISHED GLASS BRACELET RED,90039A,3.73,0.48,0.71,0.81
YRrroxGDsu4uTG9qeJueft,MIRRORED WALL ART POPPIES,21371,4.96,0.28,3.17,0.36
WZjkyozzKwotr92JUSStnC,WHITE/PINK CHICK DECORATION,35912B,1.25,0.82,1.05,0.16
iK6APPtf3UXmqveGk6ZBE4,WRAP ALPHABET DESIGN,23230,0.42,0.37,0.39,0.06
R6wEc6NnmNN5Ker9DFyhLk,PINK FELT EASTER EGG BASKET,85206B,1.65,0.49,1.5,0.09
SBg6NxpHnmRbQVYvzfLEoj,HANGING BUTTERFLY  EGG,85189,0.85,0.18,0.38,0.55
LaSTptHWXWX22rUwcS6AUi,PINK HANGING GINGHAM EASTER HEN,84745A,0.42,0.13,0.38,0.09
mVPRozySUui66vukhWqUbA,BLUE HANGING GINGHAM EASTER HEN,84745B,0.42,0.26,0.33,0.22
Gw5BMfL3bxL3Z5S2JnXWjU,RED STONE/CRYSTAL EARRINGS,90130D,2.9,0.92,1.01,0.65
o5t7MArBofamaVAcJujWNR,BLOND DOLL DOORSTOP,21117,6.75,2.43,4.93,0.27
geGZe46KLftgfgCCeiMJWB,YELLOW EASTER EGG HUNT START POST,21459,1.95,0.99,1.29,0.34
GnWaPAbrFqbh6M7Kgn6isu,GREEN EASTER EGG HUNT START POST,21460,1.95,0.38,1.42,0.27
3izVALqqrPPfgv2N6YC5GX,HARDMAN MUG 3 ASSORTED,37468,7.46,2.55,5.37,0.28
bQMJ27CCqhwrSeAdMkhg2d,POTTING SHED CANDLE CITRONELLA,21897,5.79,4.37,5.33,0.08
YZECSz4gg7eVrQQFBa7UNJ,ORANGE SCENTED SET/9 T-LIGHTS,85231g,1.63,0.55,1.43,0.12
Zy6KXZamwgz7aX9yudhd3f,PINK CLEAR GLASS CANDLE PLATE,72369A,2.46,2.42,2.41,0.02
XdJHKgBfuCVHg3Qre5tBxS,SET 3 SONG BIRD PAPER EGGS ASSORTED,22967,2.55,2.0,2.35,0.08
GiSjKmcStmDgEskS4ufQk5,SET 3 PAPER VINTAGE CHICK PAPER EGG,22957,2.55,1.42,1.94,0.24
6DXHnqbhajUwgve8NXMkiH,SET/20 FRUIT SALAD PAPER NAPKINS,21082,1.63,0.41,1.42,0.13
KQ9bSEf2FBWKhy3WjycQST,MIRRORED WALL ART LADIES,21368,2.55,1.52,1.89,0.26
TMtiHqawhyxUDUfdAeLcbH,ASSTD RASTA KEY-CHAINS,17174,0.42,0.33,0.37,0.11
3SUScugs6PTiEhvHYyH8LY,WRAP POPPIES  DESIGN,23233,0.42,0.37,0.39,0.08
VWWNwEUgSLPd7dvwHVohnf,EASTER BUNNY HANGING GARLAND,35921,1.25,0.29,0.9,0.28
WG27hiZ5n7Lxkbtxs952aD,BUNNY EGG BOX,85200,1.25,0.18,0.95,0.24
KNg2VQu4i9zTVQKYY48GRi,EASTER BUNNY WITH BASKET ON BACK,84231,0.65,0.52,0.56,0.14
ncWDXmdFHxJvJ2Nj5ywxpQ,BLUE EASTER EGG HUNT START POST,21461,1.95,0.74,1.27,0.35
VpxYGm2GJuBhdq5p4SNUPf,3 PINK HEN+CHICKS IN BASKET,84462,1.25,0.78,1.01,0.19
DVJRBZZZCLaiCeirPrBCEy,12 PINK HEN+CHICKS IN BASKET,84461,2.55,0.25,1.33,0.48
NcrRTtpVRe7nqkKdvLSKut,EASTER BUNNY WREATH,35922,4.95,3.24,3.51,0.29
Ak6kvjSJT5Kjftae94t9jF,FROG KING WATERING CAN,84675,2.95,1.76,2.33,0.21
Bk8yb2rFCQhAEQ842wTL2o,ASSORTED SHAPES PHOTO CLIP SILVER,47469,0.65,0.29,0.36,0.44
AMdcEEQ46famGh7bbEjxmL,WRAP VINTAGE PETALS  DESIGN,23232,0.42,0.14,0.17,0.6
XnbQx8UuWVVEbkNPuj7v8a,PINK BUTTERFLY CUSHION COVER,84905,4.95,0.41,0.45,0.91
ENiLwCfiWd6fGnNk8nshqp,WHITE CANDYSTUFT ARTIFICIAL FLOWER,84806B,1.45,1.33,1.41,0.03
cFEowkZSerqJ94cfjP3a2E,2 PICTURE BOOK EGGS EASTER BUNNY,21458,1.25,0.61,0.73,0.42
6XPsZ2udKj78dG7evmTJFn,ASSORTED FARMYARD ANIMALS IN BUCKET,85198,0.85,0.24,0.31,0.63
jmzBooZifLuFAgWvju6FWR,SILVER LARIAT 40CM,90191,12.48,12.46,12.36,0.01
m9V45BqaTxLR2jp4RuU7Kd,BLUE SAVANNAH PICNIC HAMPER FOR 2,84796B,24.96,8.52,22.96,0.08
bTrFfLxgjPj46XTXrLRQrD,MEDIUM CERAMIC TOP STORAGE JAR,23166,1.04,0.51,0.86,0.17
JyExoMHn7x9WLdWL2Y3Dkn,ZINC HEART LATTICE 2 WALL PLANTER,20845,6.35,4.55,6.03,0.05
d49kXAFi7TiGcZsdEc2xbh,FLAG OF ST GEORGE,84033,1.65,1.39,1.47,0.11
GtaGYKH9GbWLYktbf7vycj,S/4 PINK FLOWER CANDLES IN BOWL,85040a,3.29,2.94,3.19,0.03
K2P2b9N6WEkbc5PgcGy4KP,LARGE BLUE PROVENCAL CERAMIC BALL,20795,4.13,0.52,1.57,0.62
d46QRJsoHghoLDhX2aH2fJ,PINK HAPPY BIRTHDAY BUNTING,47590b,10.79,8.38,10.47,0.03
YEqPbNcZ4LXBKBPGQUKYJ9,SET/3 ROSE CANDLE IN JEWELLED BOX,72807a,8.29,4.1,5.8,0.3
PtcQv3f7VUimu8LC5cieqB,HEN HOUSE W FAMILY IN BARN & NEST,84226,0.85,0.02,0.65,0.24
PcNrPf9PfZ5ruH9JccAiCz,WHITE CHERRY LIGHTS,79323W,6.75,5.65,5.8,0.14
NpoPyG26djnPddXHCLcbpu,RED/CREAM STRIPE CUSHION COVER,21926,1.25,0.62,1.05,0.16
bTfiyWDke55Gn9GQWA3y8S,PINK CHERRY BLOSSOM CUP & SAUCER,37379A,1.25,0.11,0.57,0.54
YwsF5gpaZGRXgQpi48k2NZ,FOUR RABBIT EASTER DECORATIONS,35920,1.25,1.25,1.24,0.01
izcXy7YKGWNypUcknM8fNa,PINK HYDRANGEA ART FLOWER,84801A,2.1,1.36,1.76,0.16
creZL9acaYWQvzj6DSQBcc,CROCHET ROSE PURSE WITH SUEDE BACK,84592,2.95,2.2,2.33,0.21
cHNZkGDAZrYt99ijSQnnhv,SMALL WHITE/PINK ROSE ART FLOWER,84800S,1.25,0.97,0.98,0.22
keyxFNdofYzvfbUyuMcyjN,RETRO PLASTIC 70'S TRAY,79192A,1.25,0.24,0.7,0.44
JgbAXJ9FUHsVP349sfRzEH,BEADED CRYSTAL HEART BLUE  LARGE,85130C,1.65,1.07,1.52,0.08
843YzgmVBGeR6ShiLRWS6d,GREEN FERN POCKET BOOK,20756,0.85,0.16,0.39,0.54
aEyaADQoMDigXTd4T8Y5PF,GLASS CHALICE GREEN  LARGE,21320,4.96,4.53,4.66,0.06
YM4Fe2QQENs8EAGqdLTnkU,GLASS BEAD HOOP EARRINGS GREEN,90027C,2.9,1.4,2.29,0.21
HKiPfLdYs2dZGj59gSChRa,WHITE ENAMEL FLOWER HAIR TIE,90202B,2.9,0.31,1.71,0.41
HqQYDSxfqvphwpERafRtuc,UNION JACK HOT WATER BOTTLE,22125,12.46,8.73,10.09,0.19
oCCWGhNCGWsx4bowSBAihe,RED DAISY PAPER LAMPSHADE,40046A,1.25,0.61,1.03,0.18
Zz64DEomBATas9rdTdyBsw,GREEN METAL SWINGING BUNNY,85188A,1.63,0.63,1.24,0.24
UXZRds9X3bLMSEyWJSqaNq,FLAMES SUNGLASSES PINK LENSES,84527,1.95,1.95,1.93,0.01
TXjfcuPZ4dsdG9rJDhpC9B,PINK PILLAR CANDLE SILVER FLOCK,72799C,2.95,1.72,1.89,0.36
njKAunvkPYdZ82mxf3GBX9,STANDING FAIRY POLE SUPPORT,71101E,0.85,0.75,0.82,0.03
Rwx4pZ4B5Bx4FxuELU72LD,2 PICTURE BOOK EGGS EASTER DUCKS,21457,1.25,0.17,0.35,0.72
RDnzc3GgWkzpKcVuMF8PQG,2 PICTURE BOOK EGGS EASTER CHICKS,21456,1.25,0.77,0.99,0.21
icyzyqSDxMYzy6KeJEscs5,VINTAGE BEAD PINK SHADE,35647,1.25,1.01,1.17,0.06
bPLsyVAAZKwW6APLis3n7m,DECORATIVE HANGING SHELVING UNIT,84632,59.95,2.51,15.59,0.74
2CgqYupmP59hmPUvtSESce,4 ROSE PINK DINNER CANDLES,72801c,2.46,2.31,2.41,0.02
hixzQjSXRyt8i7ztYYQX6X,"RUSTIC WOODEN CABINET, GLASS DOORS",22764,49.96,11.86,23.98,0.52
HNU9hHxDej3Dbbbwu7toDN,TINY CRYSTAL BRACELET RED,90037A,2.48,1.41,1.96,0.21
ZJUzgdyDnNfmNtnAnzyoFp,WHITE/PINK CHICK EASTER DECORATION,35913B,0.85,0.62,0.7,0.18
ZBJiCjjT5jV9MCz7JANYoE,EASTER CRAFT IVY WREATH WITH CHICK,22146,1.95,1.35,1.56,0.2
Xj5PuazvxXhKTrLTgECa8N,STEEL SWEETHEART ROUND TABLE CREAM,21476,14.95,6.44,6.73,0.55
irZJxwee6xBhN7xW9ckszS,ORANGE FLOWER MUG,37351,1.25,0.95,0.96,0.23
WKUR8Ydh8UPpctHhGBdnvK,WHITE BIRD GARDEN DESIGN MUG,85160A,1.25,0.27,0.7,0.44
RZWu5roeBGdfe6JMvhojyM,GREEN 3 PIECE POLKADOT CUTLERY SET,84997a,8.29,8.0,8.04,0.03
DC2293JCvxsHXxFjZdKS5b,MOROCCAN BEATEN METAL DISH,21344,20.79,13.23,15.59,0.25
5DEFb28xoKPr8aNykNrzb4,S/2 ZINC HEART DESIGN PLANTERS,84974,9.95,6.49,8.96,0.1
gFN39kYsvg4FUEiifvFQzi,CUPID SCENTED CANDLE IN GLASS,72821,1.65,0.15,1.6,0.03
BanSGpoePmoDZwTwVfkQXW,CHRISTMAS STAR WISH LIST CHALKBOARD,22596,0.72,0.41,0.6,0.16
hh7NVBuo3DoQBnkb8NFCLA,WHITE HEART OF GLASS BRACELET,90123D,5.95,0.29,3.93,0.34
geYaY7ZJosC7689fgiozLn,PINK HEART OF GLASS BRACELET,90123A,5.95,3.58,5.18,0.13
FbKUWbW8G4GbyVy2MUSRxi,LONG SILVER NECKLACE PASTEL FLOWER,90148,12.75,9.26,12.37,0.03
29GFrRWq6MpFuywhBc9TpL,GOLD/M.O.P PENDANT ORBIT NECKLACE,90016B,8.5,5.44,6.8,0.2
YrBUi4DjcJa5yUPkArgZN2,SILVER/M.O.P PENDANT ORBIT NECKLACE,90016A,8.5,2.09,3.91,0.54
iyK3sgxkGCTwVWEQate8Nq,FLORAL BATHROOM SET,84847,3.75,2.28,3.23,0.14
j3VyASn9BH9sgKFtvJw4rM,VINTAGE NOTEBOOK TRAVELOGUE,20898,2.95,0.23,1.77,0.4
kHbyZyVSkzRoePJiuCrUCX,BLACK DROP EARRINGS W LONG BEADS,90183C,2.9,1.58,2.29,0.21
mzcou5VwHhBfQVBy3LnVMt,15 PINK FLUFFY CHICKS IN BOX,84465,2.95,1.24,1.3,0.56
a49EkzexEzc62VEWtaJWjS,ZINC HEART LATTICE TRAY OVAL,20851,5.95,5.65,5.83,0.02
EMEzYDePjGmAAvisgFQpnf,SET OF 6 ICE CREAM SKITTLES,84715,2.95,1.42,1.95,0.34
JoVnbkJKSD47q4mkKwFMZN,BLUE CUSHION COVER WITH FLOWER,84919,6.95,1.41,2.02,0.71
LsLJpsWDQUfvAbjUvyngXQ,PINK YELLOW PATCH CUSHION COVER,84907,7.65,2.7,4.82,0.37
dUYkvYVoH9LShmNkVXF44A,EAU DE NILE JEWELLED PHOTOFRAME,85024B,1.65,0.9,1.48,0.1
XPNDckfw76kfyjAeGNCpyS,PINK STRING CURTAIN WITH POLE,35637C,19.13,8.86,9.37,0.51
hw2gza7z4GATYtzLBPe2Ar,A4 WALL TIDY RED FLOWERS,71496B,0.65,0.43,0.57,0.13
UJYR7GBZghAhZyuXPrzcBd,INCENSE BAZAAR PEACH,17028J,0.42,0.26,0.26,0.38
nA9mxg8PwiAkGxG5VFSqJy,TRANQUILITY MASALA INCENSE,17084A,0.21,0.18,0.2,0.03
Y5eZZB9Mf3xuaUHZATgT8D,OCEAN STRIPE HAMMOCK,84795C,7.95,1.1,2.23,0.72
eSp2mHW48haSeRVKLoTjk8,ELEPHANT CLIP W SUCTION CUP,62074B,0.42,0.16,0.18,0.57
oAeeYms7ruwws6gAhX4cZn,CHERRY BLOSSOM DECORATIVE FLASK,84279B,3.75,2.1,3.15,0.16
6LcAPtRmVhSzkmfkj2o2Ez,CREAM SWEETHEART MAGAZINE RACK,85063,14.95,13.33,13.75,0.08
6z2sjA84Fz4ZU9AJym2pG9,WHITE HYDRANGEA ART FLOWER,84801B,2.1,1.41,1.64,0.22
WjmKScbQDYiWTcpAyv6JvQ,CREAM CLIMBING HYDRANGA ART FLOWER,84805A,3.75,3.43,3.6,0.04
Tf2hjuxRThCUuXMH6aiZ9j,BLUE STONES ON WIRE FOR CANDLE,17136A,0.21,0.1,0.14,0.35
m7XFsdF6YXNf62MNsutfWs,75 GREEN PETIT FOUR CASES,84993a,0.83,0.34,0.34,0.59
gpv65JERcbBavjaMm4YaSy,SET/3 OCEAN SCENT CANDLE JEWEL BOX,72807b,8.29,6.68,6.96,0.16
QYjYkLs7p6uMcpZP7k5BwH,SET OF 4 FAIRY CAKE PLACEMATS,84509b,7.46,4.73,6.49,0.13
aL2ECGU3kZdTuCLQZWF4Wq,PINK JEWELLED PHOTO FRAME,84708B,4.95,4.45,4.85,0.02
8j7RuMShiP9HE5ZWqGnNY8,PINK GAUZE BUTTERFLY LAMPSHADE,44089A,0.42,0.04,0.08,0.81
RDMv5EYDyqWdjeckLRi2wA,CHERRY BLOSSOM CANVAS ART PICTURE,84723,7.95,1.02,4.61,0.42
Aux9BvsakNFZvvtwGRf7qF,BOTANICAL LAVENDER GIFT WRAP,22038,0.42,0.13,0.24,0.42
Wk7ZY2wSWMSy6spyMh6XfP,NECKLACE+BRACELET PINK BUTTERFLY,90098,2.55,0.11,0.48,0.81
FLaD6dPBD4swznQ5tYjHiE,ICE CREAM DESIGN GARDEN PARASOL,15058C,7.95,5.27,7.31,0.08
g8Terdr6k2D89VAenFiwoe,SET 2 PANTRY DESIGN TEA TOWELS,22989,2.95,1.32,1.95,0.34
EsJ489RZAz6xQp3NP78U7j,SET OF 16 VINTAGE RED CUTLERY,84968d,24.96,15.72,22.46,0.1
kpDRRT49oPtegJuWGyM6nz,SET OF 4 ENGLISH ROSE PLACEMATS,84509a,7.46,1.13,6.94,0.07
Xw5mDy4tQG6CBF4ZeqSZ8S,METAL RABBIT LADDER EASTER,84452,0.85,0.38,0.58,0.32
J2kr2VmKrYVjGwTdQuqgTH,LUNCH BOX WITH CUTLERY FAIRY CAKES,22353,2.55,2.34,2.4,0.06
VcemUS44VgzhaZFGqWtUEp,COTTON APRON PANTRY DESIGN,22990,4.95,1.01,2.52,0.49
YNHQNzq8TwxgGiBnasEvcA,CANDY SPOT TEA COSY,85092,3.35,2.43,3.12,0.07
5g6eWkDrZXtBaQd8MQ5SHM,ICON MUG REVOLUTIONARY,37413,1.25,0.61,0.95,0.24
joeJvUZYro4nhyiiGHTiVR,"ACRYLIC JEWEL SNOWFLAKE, PINK",35815P,2.1,0.37,0.88,0.58
DXbCyUeaDm5UScgxFrC4Hg,"POCKET MIRROR ""GLAMOROUS""",21228,1.25,0.77,1.2,0.04
mmtc69PWTTDFMvSz4M3F4r,ENGLISH ROSE NOTEBOOK A7 SIZE,84536a,0.79,0.4,0.56,0.29
2LEnai8HVbaAaGpqr5qGrM,LARGE ZINC GLASS CANDLEHOLDER,72812,4.13,2.51,2.77,0.33
Soexs4a9gC6HHGyhrRmKfa,VINYL RECORD FRAME SILVER,82001s,7.46,2.92,5.22,0.3
FFiEEskRzJbaCCYKpCdTUN,"RETRO PILL BOX , REVOLUTIONARY",79063D,0.42,0.29,0.4,0.04
hvaJw9EQKkgzzCVN6LeFz3,PAINTED SEA SHELL METAL WINDCHIME,75172,3.75,1.49,2.96,0.21
dLBybD7eA7SnxQMiZ2RwJX,FOLDING SHOE TIDY,45013,2.95,2.49,2.68,0.09
naX4TNk5RqXsUAGsfnJTP5,MADRAS NOTEBOOK MEDIUM,21636,2.55,0.94,2.04,0.2
jy7zYYnaogNHjKrEcY84Ag,SQUARE METAL CANDLEHOLDER BASE,71510,0.85,0.78,0.8,0.06
RqpA8NKFNiQBLhZgmtBvDg,M/COLOUR POM-POM CURTAIN,44265,4.25,2.75,3.61,0.15
WQuB6UhfJQrWpfMZPq7zR6,BLACK VINTAGE  CRYSTAL EARRINGS,90064B,3.75,2.46,2.66,0.29
iwwp6cKoCSVyEG4dUEfsbw,WHITE VINTAGE CRYSTAL EARRINGS,90064A,3.75,2.27,2.29,0.39
JV7izXJvJigENywafe5JaL,WHITE VINT ART DECO CRYSTAL NECKLAC,90063A,8.5,1.45,4.93,0.42
6csxsd5uKM9YBmhSAZGTEa,BLACK VINT ART DEC CRYSTAL NECKLACE,90063B,8.5,7.76,8.16,0.04
FZxJ6ZStLjiEeU8TxVPESL,NEW BAROQUE SMALL NECKLACE BLACK,90029,8.5,8.2,8.24,0.03
TnqCFSKaVksEyR6uNT6zR8,LILAC GAUZE BUTTERFLY LAMPSHADE,44089C,0.42,0.26,0.34,0.18
7rt8TLe27LHF38ZbuaUiCu,PINK/PURPLE CIRCLE CURTAIN,44236,4.65,4.17,4.56,0.02
icEjV7FNiYN5PawB8q4FJT,POTTING SHED ROSE CANDLE,21898,2.46,1.7,2.29,0.07
gMiLpW8LHooxg3BmFV9f5j,HEART BUTTONS JEWELLERY BOX,82095,4.96,0.99,2.38,0.52
cpz8p6ZV5aaDinCWJeoQjd,NEW BAROQUE B'FLY NECKLACE RED,90024B,8.32,2.42,3.08,0.63
kdVHPjveEjZu7zhTN3NWoU,PURPLE FOXGLOVE ARTIIFCIAL FLOWER,84798B,2.55,1.34,1.68,0.34
gFZfv29p2UmGzgPoz7kDkV,PINK ALLIUM  ARTIFICIAL FLOWER,84803A,1.69,0.44,1.61,0.05
EaXvedJNPwdoZsEYoFZtL4,GIANT MEDINA STAMPED METAL BOWL,21681,9.95,8.9,9.25,0.07
e5LmHHH4rNkrBhLRBA5Nxs,PINK FLOWERS RABBIT EASTER,35909B,2.95,1.31,1.65,0.44
