id,Description,StockCode,UnitPrice,ProfitMargin,DiscountedPrice,DiscountPct
gwSwTrY53ennuBfU6ZuW82,WOODLAND  HEIGHT CHART STICKERS,21249,5.91,4.83,5.61,0.05
Wd46A9CNDRo5C9nYB4iDVU,WHITE GOOSE FEATHER CHRISTMAS TREE,21262,7.62,1.3,3.2,0.58
dbEt9bnnd3Vq6E8yo2ZyY9,GLASS HEART T-LIGHT HOLDER,21313,1.66,1.03,1.29,0.22
FPocYLiw3wix44hmdrpgQ9,IVY HEART WREATH,21349,13.57,2.6,8.68,0.36
9TDVgFj7FxknpTH83bqi8U,EUCALYPTUS & PINECONE  WREATH,21352,5.91,0.22,3.84,0.35
9tLQZP4HEymMvKgk8C6bWt,TOAST ITS - BEST MUM,21354,2.51,0.83,1.81,0.28
dEJExD8DLMBJi9BP8sQdRN,MIRRORED WALL ART STARS,21365,5.91,2.8,5.73,0.03
AH7LauJLhbtxfbS8Zhh8CV,MIRRORED WALL ART PHOTO FRAMES,21366,8.47,2.87,7.54,0.11
U85C7PqBAnd5mgF6uBZkZL,MIRRORED WALL ART SPLODGES,21369,7.62,3.4,4.27,0.44
Gqa9rgSwYMwfyTXTL5DxkH,MIRRORED WALL ART TABLE LAMP,21372,5.91,0.67,3.37,0.43
CTvauaUBT9BiCg4uCnVxHw,IVORY HANGING DECORATION  HEART,21385,1.66,1.59,1.61,0.03
RxdoW7o5TC3e47mU6dbPDy,BROWN CHECK CAT DOORSTOP,21407,8.47,8.24,8.3,0.02
3EwXwcco7SrEETB6UrbLEa,SPOTTY PINK DUCK DOORSTOP,21408,8.47,3.83,7.71,0.09
BsCqQ7m8sWJ2ayFEbuV9pT,"ELEPHANT, BIRTHDAY CARD,",21507,0.85,0.74,0.77,0.09
iHpNx226eTPvUJTHbLLnMn,RED HEART SHAPE LOVE BUCKET,21563,5.91,5.07,5.38,0.09
Edu2YJrMGQcVRUnoksDbmJ,PINK  HEART SHAPE LOVE BUCKET,21564,5.91,0.46,4.85,0.18
JrocnuCtmrcRfTECU536uM,ASSORTED MINI MADRAS NOTEBOOK,21634,2.51,1.42,1.86,0.26
bq4xorDEbBK9mPnrRjrtK9,ASSORTED TUTTI FRUTTI KEYRING BALL,21641,1.66,0.45,1.49,0.1
2oWCVrMg7mmCqNzCyc5uDX,SKULLS  STICKERS,21679,1.66,0.64,1.34,0.19
39DUdDCK3b4pQ2BtwUGq8N,BAG 125g SWIRLY MARBLES,21703,0.85,0.07,0.76,0.11
jThntYroy6RaM2Lt6FqL92,BAG 250g SWIRLY MARBLES,21704,1.66,0.07,0.51,0.69
Gg8wJoSUWytENzxra3LfCb,CANDY SHOP  STICKER SHEET,21721,1.66,0.66,1.05,0.37
b5qwxYCPNtVNhktBhm8zYY,SWEET PUDDING STICKER SHEET,21722,1.66,0.45,1.39,0.16
QsFUFbfh8TetmLUpnJHDSn,VINTAGE SHELLS PRINT,21758,12.72,4.57,5.98,0.53
Pwr89Q5ugGQwq2AxggMuGn,SET OF SALT AND PEPPER TOADSTOOLS,22892,1.25,0.26,0.27,0.78
5wN9P2Q5xsb7V28x7C65Uh,"HOOK, 1 HANGER ,MAGIC GARDEN",22245,0.85,0.64,0.69,0.19
2jDw6H7kiqMVpsoKirdqnN,PORCELAIN HANGING BELL SMALL,20957,1.45,1.11,1.41,0.03
YpsfKn6DUNpG7XnLyjoq4k,PAINTED LIGHTBULB STAR+ MOON,79144B,0.42,0.37,0.4,0.05
YxhcysXhUxmuFA4Y93FK5f,BLUE TEA TOWEL CLASSIC DESIGN,22482,1.25,0.96,1.16,0.07
SdBw2MfkGTLoCabJJKjnhq,SET 12 KIDS  WHITE CHALK STICKS,21917,0.42,0.12,0.18,0.57
4ZByKkQArx2cmUGb4wRajx,LITTLE GREEN MONSTER SOFT TOY,20697,2.55,2.1,2.24,0.12
ML2hLs6Q5vbvxrdWYw74Ay,CHRISTMAS MUSICAL ZINC STAR,22599,0.85,0.66,0.72,0.15
E6Eqtux3BWT5M77dEMYqG9,CHRISTMAS MUSICAL ZINC HEART,22597,0.85,0.05,0.13,0.85
KduSphnUKP4YMPArGBbMcN,SKULLS AND CROSSBONES WRAP,21495,0.42,0.28,0.3,0.28
BQ9W5AP2CfpF4hYRhNRSfw,POLYESTER FILLER PAD 45x30cm,46000R,1.45,1.15,1.22,0.16
7B5vVhSj536MSfb9G6Vxsr,POLYESTER FILLER PAD 40x40cm,46000S,1.45,0.62,0.9,0.38
Z5LYUDbMGK5tSy5hLfBHcc,PINK FLOWER FABRIC PONY,84920,3.75,2.86,3.45,0.08
g7dG8xQDeM8Ttqt6t9d5ot,BIRTHDAY PARTY CORDON BARRIER TAPE,22953,1.25,1.08,1.12,0.1
2s8AGrLXGhsA992XCymCq9,CAMOUFLAGE DESIGN TEDDY,84508A,2.55,0.53,1.86,0.27
EFMXFgWSWZyELzCHWBRjfE,BLUE SPOT CERAMIC DRAWER KNOB,21670,1.25,0.66,0.91,0.27
iAmNpNRc5N4KxepV5ckCHj,CUSHION COVER PINK UNION JACK,22786,5.95,4.66,5.59,0.06
UHah6V3ADn48NxTpcv4pPP,FOUR HOOK  WHITE LOVEBIRDS,22212,2.1,1.79,2.04,0.03
5pkvRtUYroq5BJ5qcoCkbh,FRENCH BLUE METAL DOOR SIGN 3,22678,1.25,0.89,0.91,0.27
AbpeSDPp5pmQJ2McSVXKgZ,FRENCH BLUE METAL DOOR SIGN No,22686,1.25,0.85,0.89,0.29
YZHGpW8ruZ2D8nuhCTQQxm,BEACH HUT KEY CABINET,84685,3.75,2.17,3.67,0.02
HzvwuauoFsrVpV6DU7fMRz,CHERRY BLOSSOM PASSPORT COVER,20616,2.1,2.07,2.06,0.02
GwsZbjYfmkWdtcGDKD7zjn,SMALL YELLOW BABUSHKA NOTEBOOK,22753,0.85,0.36,0.41,0.52
UZ2ucYv9KuQXfjjEWCfWC6,RETRO MOD TRAY,79066K,0.85,0.6,0.72,0.15
8dJ4T4tMxvswRwUa9mvsih,SWEETHEART WIRE MAGAZINE RACK,22794,7.95,3.25,6.44,0.19
NYno5QLiXLDfNYTXsXjkib,CARDHOLDER HOLLY WREATH METAL,22592,3.75,2.78,3.38,0.1
7RdXZKZhXRLB6LjDTeDRfJ,SILVER CHRISTMAS TREE BAUBLE STAND,84352,16.95,13.74,14.07,0.17
jUGRZCSyirdZVANK5Ud7Df,SWEETHEART RECIPE BOOK STAND,22795,6.75,1.73,4.93,0.27
MDRc9rGyCajtahSepgkU7p,OVERNIGHT BAG VINTAGE ROSE PAISLEY,22278,4.95,4.33,4.46,0.1
HR5YQ6MW7mnm87cSuvJwQF,FAUX FUR CHOCOLATE THROW,22802,19.95,14.47,17.36,0.13
5cViGkUP7aBJpDRHZFcRMU,ANT WHITE WIRE HEART SPIRAL,84884A,3.95,1.84,2.84,0.28
ZLBBizrB8KcTp7Dj6aRN7L,"FEATHER PEN,COAL BLACK",51014C,0.85,0.81,0.83,0.02
FUfb4SsAJHgb9AMXL83hfQ,"FEATHER PEN,LIGHT PINK",51014L,0.85,0.47,0.78,0.08
PzvFYQi9hMVHoDC3AsFwMC,"FEATHER PEN,HOT PINK",51014A,0.85,0.83,0.83,0.02
KVJUDGwwg8Q78vJ24SJ9t9,DOORMAT AIRMAIL,22366,6.75,3.86,5.94,0.12
2yXrf89NXxYiYWLg5cqfjB,DOORMAT 3 SMILEY CATS,48111,6.75,1.3,5.4,0.2
cPWUGLafAQB9q9nboM9mAu,BREAD BIN DINER STYLE RED,22846,14.95,10.87,13.16,0.12
TNdWefAWTLwknodZrfPTPE,MAGNETS PACK OF 4 VINTAGE COLLAGE,22402,1.25,0.61,0.64,0.49
SQ24osFsvasCXUKgT3gbh6,MAGNETS PACK OF 4 HOME SWEET HOME,22400,1.25,0.41,1.21,0.03
aatspNsV79BnWme6x7pgKd,MAGNETS PACK OF 4 CHILDHOOD MEMORY,22399,1.25,0.72,1.09,0.13
gC3FXW45JM5UZfgU98aih8,"ART LIGHTS,FUNK MONKEY",79302M,2.95,2.1,2.45,0.17
98DYe75t5aze5nidU9gME8,MINI CAKE STAND WITH HANGING CAKES,37446,1.45,0.63,0.9,0.38
Ab4cM8bgmhNfGUojSeWZQP,SET OF 4 FAIRY CAKE PLACEMATS,84509B,3.75,2.64,2.85,0.24
TktxnBi6MP9FBEcCGwzsfs,OFFICE MUG WARMER PINK,22313,2.95,1.04,2.01,0.32
FTKr7vs96X5uPf5Lf7Ubo5,PLEASE ONE PERSON METAL SIGN,21181,2.1,1.48,1.83,0.13
Evz6wFQFEgjNhvZJDj7FZg,GLITTER CHRISTMAS HEART,21818,0.85,0.1,0.77,0.09
mBDjcBhZxCYDgfqXhDmYQb,RED STRIPE CERAMIC DRAWER KNOB,21668,1.25,0.23,0.94,0.25
TyKJcstjyCynX4xppnPyuc,"NURSERY A,B,C PAINTED LETTERS",21462,6.75,1.65,5.2,0.23
Ee6nyMgFUAfzoeZxgViy3f,SET OF 2 ROUND TINS DUTCH CHEESE,22496,2.95,1.13,2.51,0.15
Q2Tz6VnoFwjgnqah6b9A4u,GREEN GEISHA GIRL,84870C,3.75,3.15,3.19,0.15
4QcjXT3omG5eHSR2tk62Rp,BLUE GEISHA GIRL,84870B,3.75,3.21,3.64,0.03
Y7QRX2q97Tc6f5jzrtqSCV,NEWSPAPER STAND,22765,14.95,4.09,12.56,0.16
HJixjySqUnuHgA9GfDQu97,CINAMMON & ORANGE WREATH,21351,6.75,1.13,3.1,0.54
kHJZPGE8xAAeta8hRHvVnx,WOOD STOCKING CHRISTMAS SCANDISPOT,22581,0.85,0.8,0.82,0.04
GWDY5xCYsS2J76AJVb5Xx9,WOODEN TREE CHRISTMAS SCANDINAVIAN,22579,0.85,0.22,0.57,0.33
T3sj2oZcxVdFAsTyhpgpNX,ROCKING HORSE GREEN CHRISTMAS,22572,0.85,0.34,0.42,0.51
cpoierJZvBZYCYAYsDWKQF,SET OF 4 NAPKIN CHARMS 3 KEYS,22640,2.55,1.9,2.09,0.18
F4tmDpXVmpCJxtGRTaAeFV,SET OF 4 NAPKIN CHARMS INSTRUMENT,22641,2.55,0.06,0.38,0.85
izNRufHPPrVqidn7XR8ZaC,SET OF 4 NAPKIN CHARMS CROWNS,22638,2.55,2.27,2.42,0.05
gdpMaJ6H8saynjQsaSC8WF,SWALLOW WOODEN CHRISTMAS DECORATION,22576,0.85,0.7,0.8,0.06
9ojrvHt4cFyYabPdcA5WVL,GLITTER CHRISTMAS TREE,21817,0.85,0.22,0.77,0.09
ekdUn6AmXN6khoRMFLoWkL,GARLAND WITH STARS AND BELLS,21813,4.95,2.79,4.75,0.04
kfkcX6YfGJMwqwdpxFr8oy,"CHRISTMAS GARLAND STARS,TREES",21808,3.75,3.45,3.52,0.06
QLQ6ro5FE6vneeVLtNbkAF,SWISS CHALET TREE DECORATION,21014,0.85,0.53,0.65,0.23
jogF8EshPjCSo6NPUwSmHs,BIRD BOX CHRISTMAS TREE DECORATION,21018,0.85,0.5,0.55,0.35
e7mDAo6amXTBHbDEyeBsbi,WOODEN ADVENT CALENDAR CREAM,22946,16.95,8.07,11.7,0.31
dAqiKQbsv7CkeJ3gW5eKQm,DOORMAT I LOVE LONDON,22660,7.95,3.03,6.44,0.19
8k9QV6YjNcDNkRq5C2nb9N,WOOD AND GLASS MEDICINE CABINET,21761,29.95,21.0,22.16,0.26
XjfSfh2Sg55kqovk4bzdG9,MA CAMPAGNE CUTLERY BOX,21781,14.95,1.75,8.82,0.41
CcvB5ibRqJDomoRgRrXbae,WICKER WREATH LARGE,22696,1.95,1.42,1.81,0.07
36K6u5hvHPgUxMC62QNPMs,TABLE LAMP WHITE SHADE WOOD BASE,84360,5.95,3.66,5.12,0.14
DJfqbBDT3JadHmHjxiWskb,SMALL FOLKART STAR CHRISTMAS DEC,35954,0.42,0.22,0.25,0.41
6XwjNdGHhKwwrXJR2jjkgJ,SMALL HANGING GLASS+ZINC LANTERN,84760S,1.45,0.57,1.15,0.21
LTPPeFwDG2RjewBkZc5r97,GREEN CHRISTMAS TREE STRING 20LIGHT,85045,4.95,0.8,1.09,0.78
SjsqPRruroQUTEc4zasq3Z,BLACK CHRISTMAS TREE 60CM,35598B,0.65,0.03,0.61,0.06
fAsbpS8kCFPQJj9G8MV5RJ,WOODEN STAR CHRISTMAS SCANDINAVIAN,22578,0.85,0.14,0.44,0.48
XgUxTsuuPfcJWR9xZkR5Rm,FINE WICKER HEART,22855,1.25,0.53,0.54,0.57
Rck5QyUEsg9UGDsw7eAMRJ,UNION JACK FLAG PASSPORT COVER,21864,1.69,0.86,0.93,0.45
FteJR8zWZhUVJpewmjJmr6,EDWARDIAN PARASOL PINK,15056P,4.6,1.61,3.27,0.29
nykMrWqPiiAPw7MuNwqZaN,S/4 CACTI CANDLES,85174,4.25,0.37,1.95,0.54
A3hMcNmrnDMHiiS7V7v3gn,PINK MARSHMALLOW SCARF KNITTING KIT,82615,2.55,1.58,2.22,0.13
ndf3ZFyEvVpoVyqRWjz7Df,6 CHOCOLATE LOVE HEART T-LIGHTS,85038,1.69,0.83,0.83,0.51
26mX5Yiw4A2a8p2RrZq2zc,3 TRADITIONAL COOKIE CUTTERS  SET,22965,2.1,1.9,2.06,0.02
Aq84bMJMp5VQxvsXSNdqJ3,MIRRORED WALL ART SKULLS,21374,3.75,0.99,1.46,0.61
RCiNbpSsmf52Q89tNsgW3f,COWBOYS AND INDIANS BIRTHDAY CARD,21509,0.42,0.31,0.35,0.17
Vho78KAGeT2xoyEhTFimPu,RING OF ROSES BIRTHDAY CARD,22025,0.42,0.09,0.17,0.59
Bu2wMxndWUoz6o4Zpagys3,ALARM CLOCK BAKELIKE CHOCOLATE,22725,3.75,1.3,3.38,0.1
7Qf3xi4Cy6AZY7DaPfuU3r,CERAMIC CAKE DESIGN SPOTTED MUG,37448,1.49,0.22,1.16,0.22
52HPWDjX5EPmSJEHJUbbJ5,LIPSTICK PEN FUSCHIA,22421,0.42,0.16,0.39,0.08
83r4AfxrNyJvnBNuLvgDET,GREEN 3 PIECE POLKADOT CUTLERY SET,84997A,3.75,2.15,3.49,0.07
icoWJ7amngE9jjCxWBE9Q7,PAINTED METAL PEARS ASSORTED,21136,1.69,0.14,0.56,0.67
H5BwHRre4pN9fkZTJxVH3S,COLOUR GLASS. STAR T-LIGHT HOLDER,71477,3.25,1.26,1.98,0.39
WW7xrcZTWFZxj7yfjuEACd,SWALLOWS GREETING CARD,22030,0.42,0.02,0.2,0.53
ZjqHVHTx3ca8AWNcrEgjNf,"LETTER ""M"" BLING KEY RING",90214M,1.25,0.65,0.86,0.31
ZsSRwzn2NV2FyyTaTWzTRC,"LETTER ""V"" BLING KEY RING",90214V,1.25,0.29,0.51,0.59
L2DAjPfcppKeoNbFzUTutG,"LETTER ""S"" BLING KEY RING",90214S,1.25,0.66,1.2,0.04
GCxckw6ZcCquWaiFVUcGgR,KIDS RAIN MAC PINK,21789,0.85,0.02,0.03,0.97
W9nHiffj9M5H2HwpBpHUws,SQUARE FLOOR CUSHION VINTAGE RED,21629,7.95,5.32,7.71,0.03
J8mLX8AiQZKtZUB578WXV8,BLUE  DIAMANTE PEN IN GIFT BOX,21850,4.95,0.39,4.75,0.04
XEgZVTtv92ecKaWZRXwPoH,36 PENCILS TUBE SKULLS,20978,1.25,0.12,0.39,0.69
4xZ2aJE4TQ9EoaJCWy9nUz,GREEN FERN JOURNAL,20768,2.55,0.49,1.94,0.24
PbtTL6JHqHmHVsJR3bTQ9D,BLACK EAR MUFF HEADPHONES,20780,5.49,2.93,3.4,0.38
cTewWQdQ254ADBEZnbrd8r,RED POLKADOT COFFEE  MUG,21398,2.1,1.8,1.83,0.13
WeLstAC8baVUXpvFG5CUgW,ASSORTED TUTTI FRUTTI MIRROR,21643,1.25,0.36,0.61,0.51
cKpoEsgE5VEGy6KLRDWLYk,SET OF 4 ROSE BOTANICAL CANDLES,21620,3.75,3.19,3.49,0.07
6C7hktnFCbLWyj9hkvJCBZ,FELT EGG COSY BLUE RABBIT,22260,0.85,0.37,0.61,0.28
ijmNV7yvTWbFKEEqcfttwu,LOVE HEART SOCK HANGER,22136,1.65,1.62,1.62,0.02
Jha5ewvPw7rbwCTFSMDbSz,COLOURING PENCILS BROWN TUBE,10135,2.51,1.54,1.98,0.21
muPTccRNpZnKheswFWrstC,FUNKY MONKEY GIFT BAG MEDIUM,16168M,0.85,0.19,0.31,0.64
XYvdFDiUcejXRJcryyNozx,ORIGAMI VANILLA INCENSE CONES,17014A,3.36,2.05,2.39,0.29
6898G3vWHwRaXQR6odQyzh,FAIRY DREAMS INCENSE,17084N,0.43,0.25,0.39,0.09
Qt9xFYPfPvgXkyXNj4weR4,DRAGONS BLOOD INCENSE,17084P,0.43,0.06,0.13,0.69
TQMVZRxKkZYsdkwCpmtKfR,FIRST CLASS PASSPORT COVER,20617,4.21,4.08,4.08,0.03
RbQxPe49C6LfmxLzABzvaa,TROPICAL PASSPORT COVER,20619,4.21,1.38,3.96,0.06
2vwSKToV25jsaVoxT8aged,CHERRY BLOSSOM LUGGAGE TAG,20653,2.51,1.65,2.16,0.14
2SCxjJ9yzqVgXWiF8sXZgy,PINK POLKADOT CHILDRENS UMBRELLA,20681,6.77,2.08,6.16,0.09
W3kpGRJwaheJgW2wXD2qpD,RED RETROSPOT CHILDRENS UMBRELLA,20682,6.77,5.2,6.57,0.03
GkqQdeMFoT3CYQeeevoNEP,FLORAL SOFT CAR TOY,20696,7.62,2.84,5.11,0.33
5ZbcU8KYffYhyqiyiTuVpn,MOUSEY LONG LEGS SOFT TOY,20699,5.06,3.06,3.95,0.22
9yzk7nYnrG5BU6keUy2Sjk,GREEN CAT FLORAL CUSHION COVER,20700,10.17,9.14,9.86,0.03
6ZxWRTxXdxN7FZkrUVc5sZ,RED RETROSPOT SHOPPER BAG,20718,2.51,1.37,2.33,0.07
E4CSQP62sEGYX8UbKFvqPZ,BLUE POLKADOT WASHING UP GLOVES,20752,4.21,0.92,3.87,0.08
mbWPsFGAg4mXjY3utb4jBR,BLUE PAISLEY SKETCHBOOK,20761,7.62,2.44,5.18,0.32
ZYsTbXuuWFCcEZA9E8xvNB,ZINC HEART LATTICE T-LIGHT HOLDER,20846,2.51,0.1,1.56,0.38
jGj5XSmi5WfM26Rb5dMwzW,BLUE POT PLANT CANDLE,20931,7.62,3.3,7.24,0.05
cM4v8rCUWmnz2rFUWPbW56,ROSE DU SUD DRAWSTRING BAG,21002,3.36,0.64,1.55,0.54
S2phnuvHB3BaND3AoCRemw,DARK BIRD HOUSE TREE DECORATION,21015,1.28,0.62,1.18,0.08
MuA36V9Vy5HYKRn8m7ETAn,VINTAGE RED TEATIME MUG,21067,2.51,0.6,2.03,0.19
BHkm5avPTbfPg2ZaVCVFEV,"LARGE CAKE TOWEL, CHOCOLATE SPOTS",21109,13.57,12.29,12.48,0.08
jqi7HAo8vth2ji5C7XnEmV,LARGE CAKE TOWEL PINK SPOTS,21110,13.57,8.83,13.03,0.04
mtEGXCmpvvM7ZiY6KmqFDL,GOLD FISHING GNOME,21128,12.72,6.5,11.45,0.1
LZvoFo5Mio9gupG6vp9ETS,HOME SWEET HOME METAL SIGN,21164,5.91,2.83,4.85,0.18
eYooSB8DJ5UmDkuAvMd8z4,3D HEARTS  HONEYCOMB PAPER GARLAND,21188,5.91,2.37,5.56,0.06
dZbqhKBT3DeFRJQoLVEuGx,PASTEL COLOUR HONEYCOMB FAN,21208,3.36,2.47,2.69,0.2
Avzaqft588w9TztwNtL94k,SET/4 BADGES DOGS,21220,2.51,1.18,2.26,0.1
BgYZDFVNm3S9A7amUSmi4E,SALLE DE BAIN HOOK,21272,2.51,2.33,2.36,0.06
9PtSyxefekXmRS3mrtJBXF,VINTAGE KITCHEN PRINT FRUITS,21279,5.06,2.47,3.79,0.25
o2enJayqgqpVER3EAbx2od,VINTAGE KITCHEN PRINT SEAFOOD,21281,5.06,3.8,4.35,0.14
AWEyqJE3XFuvn4ByDAcu8Q,STRIPEY CHOCOLATE NESTING BOXES,21288,5.91,4.67,4.85,0.18
G3ux9F6BAtedfKwg5P3pDe,TOAST ITS - FAIRY FLOWER,21356,2.51,1.68,2.43,0.03
5EzrcVbEZ3vaMX6sh7uaDX,BASKET OF TOADSTOOLS,21439,2.51,1.16,1.98,0.21
BwrY9Szzuinjco3DXoSeKb,12 IVORY ROSE PEG PLACE SETTINGS,21447,2.51,0.82,1.76,0.3
76n6u2oEVpg8nouzx9U8pk,RED RETROSPOT PUDDING BOWL,21537,8.47,6.56,7.37,0.13
T9XETs75PXRcNKhqXM9HPb,CERAMIC BIRDHOUSE CRESTED TIT SMALL,21547,5.91,5.81,5.79,0.02
XhKpTX7oadw6K6HGjZCbDR,Dr. Jam's Arouzer Stress Ball,21594,4.21,1.04,3.28,0.22
n2DvqAcmMBNciHFEHLdaeW,ASSORTED TUTTI FRUTTI NOTEBOOK,21638,4.21,2.83,3.83,0.09
jfnNvg5bG8hzPkEgSnEhFb,ASSORTED TUTTI FRUTTI SMALL PURSE,21648,2.51,1.75,2.46,0.02
PUpUDh98Mm5jzVjPEKJ23D,RIDGED GLASS POSY VASE,21656,3.36,0.42,1.24,0.63
Qsv82cPUdfcEG6XS8HaLgR,RED SPOT CERAMIC DRAWER KNOB,21671,2.51,0.55,1.86,0.26
WnXEd6HpVuJBWJ2ZNu7oX7,SMALL MEDINA STAMPED METAL BOWL,21684,2.51,2.18,2.41,0.04
gwLa32wd6v3pzBCRrAAgHE,MOCK LOBSTER FRIDGE MAGNET,21698,1.66,1.46,1.48,0.11
axRumsbvbudwWWxahKGPDa,BIG DOUGHNUT FRIDGE MAGNETS,21700,8.47,7.08,7.2,0.15
4DL7sCg9NxuMDEeznzD6Zq,GAOLERS KEYS DECORATIVE GARDEN,21745,8.47,1.98,5.42,0.36
B3sCnMKcQfGYADNgcqQmCx,DECORATIVE FLORE BATHROOM BOTTLE,21775,2.51,1.71,2.36,0.06
iopAejPKi2A4voCheffJmd,GLITTER HEART GARLAND WITH BELLS,21820,7.62,3.26,4.27,0.44
RCxDxw2Mc7F8PWB6FJbt8E,ASSORTED CREEPY CRAWLIES,21830,0.85,0.3,0.45,0.47
MMkiVKkmzNLbv4sE98MAER,PINK DIAMANTE PEN IN GIFT BOX,21846,4.21,3.87,3.87,0.08
WEfWWn2kUc99uaN7cschuC,POTTING SHED TEA MUG,21868,3.36,1.55,1.68,0.5
XfqyiwcDKCxmnwdF4kw9H9,KINGS CHOICE MUG,21875,3.36,3.07,3.19,0.05
kf6S4J7VdxbfYHHRAugXYW,POTTING SHED TWINE,21896,4.21,2.12,2.78,0.34
EMVkRuYM98zELwkdCkn692,"KEY FOB , GARAGE DESIGN",21899,1.66,0.63,1.15,0.31
6Z7C6DBXdz2SJDR74TC9bm,PHARMACIE FIRST AID TIN,21906,13.57,7.84,12.89,0.05
hcaJ4MRCSgQsUfxZrsRu5c,CHOCOLATE THIS WAY METAL SIGN,21908,4.21,1.16,1.94,0.54
WGxY89NP7a5FXP7i3H7m2M,SET OF 36 PAISLEY FLOWER DOILIES,21974,2.98,1.79,2.41,0.19
H6Cz3PNMoNhFKqE974iA73,RIBBON REEL LACE DESIGN,22078,4.21,0.46,0.76,0.82
DPL3qzmEKSads3xtKhkrkr,PAPER CHAIN KIT EMPIRE,22084,5.91,3.87,4.79,0.19
2g73YW54GRuM8w9wGwwDPt,EMPIRE TISSUE BOX,22091,2.51,2.06,2.31,0.08
6zwbK3ZNNMhFWw56sUw4gM,SET OF 2 TEA TOWELS PING MICROWAVE,22124,2.51,0.16,2.36,0.06
SP5qN2f3TjTwENW5BNmPQF,"DIAMANTE HEART SHAPED WALL MIRROR,",22165,11.02,4.08,10.47,0.05
Zzcy9vJ7eKib3BSfYRSMgM,CAKE STAND VICTORIAN FILIGREE LARGE,22184,8.47,7.93,8.13,0.04
kL5CpsGZ2PZDHGrqBCfUUL,WOOD STAMP SET THANK YOU,22208,3.36,2.43,3.09,0.08
YQACnzc9RmBEPfhF2yEgxi,MAGIC GARDEN FELT GARLAND,22246,4.21,2.36,3.92,0.07
WBzV3o4vTMETVdJ3dyfsCc,6 EGG HOUSE PAINTED WOOD,22283,16.13,15.0,15.16,0.06
d7XUstMX86assNhk2mu7dS,COFFEE MUG BLUE PAISLEY DESIGN,22304,5.06,1.67,3.9,0.23
a92h7xqCtcN9yCuztrCRL2,TEA COSY BLUE STRIPE,22308,5.06,4.75,4.86,0.04
XbpBab9niPyc5SuyK3myQW,FIVE CATS HANGING DECORATION,22317,5.91,5.51,5.61,0.05
QoBh8biYUGkMmsun5dQy9y,BLUE POLKADOT KIDS BAG,22324,4.21,4.09,4.08,0.03
Wu7mwu2Pt4KvWiQDz8A57s,MOBILE VINTAGE HEARTS,22325,11.87,10.55,10.92,0.08
77YbGGE5Bs8uQViwZdTmLh,WOODLAND PARTY BAG + STICKER SET,22331,3.36,0.32,0.77,0.77
gykJXoxoQk6PdLMgfXQCqc,HOME GARLAND PAINTED ZINC,22342,3.36,1.89,2.92,0.13
NodfufES55Uu7enaAWvz5j,ILLUSTRATED CAT BOWL,22350,5.06,4.22,4.76,0.06
8EioytVY9QvxPxrEbyhN9z,PAPERWEIGHT VINTAGE COLLAGE,22393,5.06,3.92,4.05,0.2
VKARdnueNuU9espz3cPWdM,MONEY BOX POCKET MONEY DESIGN,22405,2.51,2.06,2.18,0.13
EEA8hb833rzvbXG3bzd6CV,MONEY BOX BISCUITS DESIGN,22409,2.51,0.5,1.41,0.44
NXzVck7YvgtneKm7fJJ5rD,LIPSTICK PEN BABY PINK,22420,0.85,0.07,0.11,0.87
TD5xjR37vfQtMfs6w4HauH,ENAMEL COLANDER CREAM,22425,10.17,9.83,9.97,0.02
KjBULmCUbvHFkSNCpyK8cs,CAST IRON HOOK GARDEN FORK,22458,5.06,3.37,4.86,0.04
LiqGfkDeWHqkKmqjSCTRRv,CAST IRON HOOK GARDEN TROWEL,22459,5.06,0.57,1.26,0.75
hHNgP2NPSMziMuvcDTEVVM,WOODEN UNION JACK BUNTING,22499,12.72,4.46,5.98,0.53
8dbej5FXvetywW6MZ4g7TL,CABIN BAG VINTAGE PAISLEY,22503,59.53,12.36,46.43,0.22
cgHLJdVbHp5fiLgLeJE8mr,MAGIC DRAWING SLATE PURDEY,22536,0.85,0.83,0.83,0.02
EaqXJMgygat7vYTDX8eUzc,FELTCRAFT HAIRBAND PINK AND BLUE,22586,1.66,0.79,1.26,0.24
FWCjJ8yB5f2LojYBXhGLjt,CHRISTMAS RETROSPOT HEART WOOD,22602,1.66,1.61,1.63,0.02
XS4zFWmHuN4JobHPUUA3Gr,STRAWBERRY FAIRY CAKE TEAPOT,22649,11.02,8.55,9.81,0.11
bHPSoMvddtPKqeSbAFmChB,PINK BABY BUNTING,22668,5.91,3.92,5.73,0.03
XFwkePxkuofLUyDXommaZv,FRENCH GARDEN SIGN BLUE METAL,22673,2.51,1.66,1.76,0.3
8mPhD6NXfV3qv9cutU7Nuc,DOORMAT WELCOME TO OUR HOME,22692,7.95,7.75,7.71,0.03
hJUKaTdR2Wb3vP2dXXMATE,POPPY'S PLAYHOUSE LIVINGROOM,22746,4.21,2.43,3.33,0.21
BMH4ZwaedAwSKh9xAcoqfR,POPPY'S PLAYHOUSE BATHROOM,22747,4.21,2.23,3.58,0.15
7AnHxFijavJHAbmoMqx6bR,LARGE YELLOW BABUSHKA NOTEBOOK,22756,2.51,1.57,1.98,0.21
Yks4EbCTo5H2WUg4UthHqv,BROCANTE COAT RACK,22788,20.38,1.87,12.84,0.37
MCfEwerHi7jdYrddA75tvZ,WHITE BROCANTE SOAP DISH,22831,5.91,4.94,5.2,0.12
mWJXHwGWKpXUwp7qGHCT3R,ROUND CAKE TIN VINTAGE GREEN,22841,16.13,14.37,15.48,0.04
msVYGRu7EcvbgrZYPig6qs,SOAP DISH BROCANTE,22863,5.91,3.08,5.73,0.03
cvwVxThUUfkgdqetQjcFuA,NUMBER TILE COTTAGE GARDEN 2,22870,4.21,1.42,3.83,0.09
PZo7Eo5Fk9Z67XpujFcPvJ,NOVELTY BISCUITS CAKE STAND 3 TIER,22890,20.38,12.23,13.25,0.35
mTrw7WLsVQqYpEEfJCR7S9,OVEN MITT APPLES DESIGN,22897,2.98,1.06,1.64,0.45
6tZNgUnhHXmDFCHwGTjgs4,CHILDRENS APRON APPLES DESIGN,22898,4.21,3.85,4.04,0.04
hYPyxfyuZTci44RWmsfGGT,CHRISTMAS METAL POSTCARD WITH BELLS,22944,16.13,5.81,15.48,0.04
5rk84fHXHrwq6Qy3KesXTx,DOLLY GIRL CHILDRENS EGG CUP,22977,2.51,1.46,2.13,0.15
2ZZv3CuAFimQmVrZiab34B,IVORY STRING CURTAIN WITH POLE,35637A,19.53,9.14,15.82,0.19
6EULjpNv5czMWSkjPRbX4h,BLUE FELT HANGING HEART W FLOWER,35916B,1.66,1.57,1.58,0.05
Pt6VoZKHJqF4VhNu2Mndrb,PINK FELT HANGING HEART W FLOWER,35916C,1.66,1.59,1.61,0.03
FizK34AqxtyhzN4keTX6yk,FOLKART CLIP ON STARS,35964,1.66,1.15,1.2,0.28
6cJnhyvef7nyGy3U76v5cC,FOLKART HEART NAPKIN RINGS,35965,3.36,0.33,2.49,0.26
cyd4iWjE9brW5VumtFro5Q,FOLK ART METAL STAR T-LIGHT HOLDER,35967,1.66,0.95,1.43,0.14
ejqkUeCugXNfPpXjQUyD65,CERAMIC CAKE BOWL + HANGING CAKES,37450,5.91,0.86,4.14,0.3
4RvgMMBpMeQ5ccpQabGEpn,YELLOW/PINK CERAMIC CANDLE HOLDER,37491A,3.36,3.25,3.26,0.03
AGbEiGWcJzUN63x4KakfCi,SUNSET COLOUR CHUNKY KNITTED THROW,46775D,11.02,10.63,10.8,0.02
f5VncS2CRfTxVCpSBEPDGH,WOVEN BERRIES CUSHION COVER,46776B,4.21,3.43,3.54,0.16
TDG5hs75Kke6otTa3nhQgC,TEA TIME PARTY BUNTING,47566B,8.47,7.84,7.96,0.06
n7PuR3Bssa4oBdTaTqNnBi,TEA TIME KITCHEN APRON,47567B,12.72,3.6,12.21,0.04
2g95RkcdnDR3TkzvkPQ9VA,BLUE HAPPY BIRTHDAY BUNTING,47590A,11.02,3.14,3.86,0.65
Cu5BBucr2GhQmQNvP9mjAg,PINK HAPPY BIRTHDAY BUNTING,47590B,11.02,8.69,8.82,0.2
oPVkatXgjzqB6qSrk7TwwK,CAROUSEL DESIGN WASHBAG,47594A,4.21,2.06,2.27,0.46
KVhQwDwXuPVXQRm4nFvBqk,LOVE HEART POCKET WARMER,70006,3.36,0.93,2.92,0.13
8sgEV5WFjVrRit3hkaRsmQ,A4 WALL TIDY BLUE OFFICE,71496A,1.49,1.37,1.4,0.06
jyVday6ZewToQFCrUgDMdq,COLUMBIAN  CUBE CANDLE,72134,1.66,0.07,0.61,0.63
bdXoKgT2UhoZtuDkzxzuXn,CORONA MEXICAN TRAY,79067,8.47,0.31,7.88,0.07
2gsJ4HGXV9dMb6SeoqjAxX,AREA PATROLLED METAL SIGN,82582,4.21,3.47,3.66,0.13
aJTjgw4fmyCUcYmwQtfBaj,FANNY'S REST STOPMETAL SIGN,82599,4.21,0.45,3.07,0.27
m3rFaTsQPMdL8ACF7N2RGV,MIDNIGHT GLAMOUR SCARF KNITTING KIT,82616C,2.51,2.27,2.41,0.04
QCM82RA9MLA68DGoPTf3ML,YELLOW METAL CHICKEN HEART,84459B,3.36,1.34,3.16,0.06
iPcyCcd5cRvcoVCtWZuBXN,PACK 20 ENGLISH ROSE PAPER NAPKINS,84520B,1.66,1.29,1.33,0.2
Q3Zcm3QY3BVjV5g2cy36xa,3D SHEET OF DOG STICKERS,84559A,1.69,0.72,0.98,0.42
mwCHzRfb5tUP4paGjxcbZq,3D SHEET OF CAT STICKERS,84559B,1.69,1.01,1.66,0.02
dwQNLTSa9GdhqcR4uk7mFV,MIXED NUTS LIGHT GREEN BOWL,84596J,2.51,1.18,1.73,0.31
JZ53KuDfx2MiY6Aso8Vh6v,TALL ROCOCO CANDLE HOLDER,84609,16.98,7.77,15.45,0.09
R3W8qij33HLP7fiAPah5ra,WHITE TRAVEL ALARM CLOCK,84659A,2.51,2.44,2.46,0.02
edZQjjuWKGzfNtGEBKJtrF,GRASS HOPPER WOODEN WALL CLOCK,84663A,5.91,0.72,1.77,0.7
msNurrVk2Jc2LcTJxqcft5,JUNGLE POPSICLES ICE LOLLY HOLDERS,84828,2.51,2.39,2.43,0.03
4xakgrG8QHqfao5fDxv4gT,LARGE TAHITI BEACH BAG,84856L,11.87,8.56,11.16,0.06
9wSQWstihm57g2kizqhTGS,HAND TOWEL PINK FLOWER AND DAISY,84915,4.21,3.47,3.96,0.06
nUmYpwEJNrWkncqRiMrghi,ASSORTED COLOUR T-LIGHT HOLDER,84950,0.99,0.21,0.32,0.68
SRtstEMiSJAA3pc2KVaTgq,RECTANGULAR SHAPED MIRROR,84976,3.36,1.75,2.05,0.39
9MhWnj8EfQPy2j77Qembpo,SET OF 3 CONEY ISLAND OVAL BOXES,85008,10.17,6.26,8.95,0.12
f3JTbmZKPCdnoEduWaChV2,SET/4 BLUE FLOWER CANDLES IN BOWL,85040B,3.36,2.33,2.65,0.21
6J77A7xwY9rSq2xwf8fBDb,FRENCH ENAMEL CANDLEHOLDER,85053,4.21,1.08,2.02,0.52
edmY7X5BABH76nnYmdTJ4p,BLACK ENCHANTED FOREST PLACEMAT,85114A,3.36,0.89,1.88,0.44
TUSKivHsmDH4UTZRAhxEw4,BEADED CRYSTAL HEART PINK ON STICK,85131D,0.85,0.28,0.52,0.39
9TRwwdcpQYm6T4u68CyM8R,SET/6 PINK BIRD T-LIGHT CANDLES,85170D,4.21,0.94,2.27,0.46
gsidTy9ra2SrUaJuYBQo7M,MINI PAINTED GARDEN DECORATION,85212,1.66,0.78,1.21,0.27
bgYPqXPmkEYiPP43GcFoqp,SET OF 6 3D KIT CARDS FOR KIDS,85227,1.66,0.71,0.71,0.57
gRQEghUFbV8BJHwuBKxfbg,SET/3 DECOUPAGE STACKING TINS,85232D,10.17,9.91,9.97,0.02
QzABFHH4qSoe7iQvyAKEA8,BLACK VINTAGE EARRINGS,90013B,4.24,2.22,2.2,0.48
9xPndRbp4V9woAD37ezwTe,GOLD M.O.P ORBIT DROP EARRINGS,90018B,4.24,3.26,3.35,0.21
Q97mXdtHJ3c35vWj8vLrrm,GOLD M.O.P ORBIT BRACELET,90019B,5.51,3.82,3.91,0.29
mkLPXLZSmkCas3CgF2HJUM,NEW BAROQUE B'FLY NECKLACE GREEN,90024C,8.49,5.71,8.32,0.02
4VV5UVzuj56qorq6oPDS4Z,"FLOWER GLASS GARLD NECKL36""TURQUOIS",90036F,8.07,7.16,7.51,0.07
nUj4qBYNHqTfXwiq8AkqZV,MURANO STYLE GLASS BRACELET BLACK,90040B,3.81,0.96,1.71,0.55
2x4Y275osdYgUZ9AVtUZPM,CRACKED GLAZE NECKLACE RED,90051,7.22,2.26,4.48,0.38
9wW5iyhVkH9qtp9u6dxfJk,CRACKED GLAZE EARRINGS RED,90054,2.54,1.47,2.46,0.03
KcxvDyeZtvyLrkRog8rh4K,BLACK DIAMOND CLUSTER EARRINGS,90077,2.96,0.87,0.95,0.68
oUyHeDLhSG8GqPjWcv8dTw,BLUE MURANO TWIST NECKLACE,90124B,10.17,3.25,8.34,0.18
UF7At3C7bcHMsTCV95p2m6,OLD ROSE COMBO BEAD NECKLACE,90134,2.96,1.16,1.54,0.48
ArWrhCDCYReGsMZfnQeP4n,WHITE/PINK MINI CRYSTALS NECKLACE,90138,5.51,3.32,3.86,0.3
7Rf82n7WsivUB5XGtqsXL2,ANT COPPER TURQ BOUDICCA BRACELET,90161B,5.09,2.76,4.07,0.2
X6duFU2y95N9rcVfVJ8p9F,PINK & WHITE ROSEBUD RING,90166,4.24,1.67,3.52,0.17
baVwKsBtBEBn5REWHtTGyy,PAIR BUTTERFLY HAIR CLIPS,90173,3.81,0.94,1.14,0.7
c5tbz3r7noshr6CvdpcYVA,DROP DIAMANTE EARRINGS CRYSTAL,90177C,2.96,0.14,1.15,0.61
Byz4YMPRUwFqWcwfRZRyiD,DROP DIAMANTE EARRINGS GREEN,90177E,2.96,0.72,1.3,0.56
FEAAqTsXsCxVGDVbRhXriU,AMETHYST GLASS/SHELL/PEARL NECKLACE,90181B,9.34,2.16,2.15,0.77
3p9G2WVRw8GXGeuESF5teA,JADE DROP EARRINGS W FILIGREE,90192,5.09,1.36,3.66,0.28
QjLFR5ANRtNyW3PehchqmX,CRYSTAL DIAMANTE STAR BROOCH,90206C,5.09,0.58,2.34,0.54
cT7w9vntXLv9ZERmx2ef74,PINK ENAMEL+GLASS HAIR COMB,90209C,2.11,1.17,1.86,0.12
aFVA8irBb4uLGgxzveahFo,DIAMOND LAS VEGAS NECKLACE 45CM,90211A,5.94,5.93,5.88,0.01
QKVpMoKU5RptSJL9oneswE,"LETTER ""A"" BLING KEY RING",90214A,0.85,0.41,0.65,0.23
3bHtyu6ptLuCqqXcZVyBad,"LETTER ""E"" BLING KEY RING",90214E,0.85,0.08,0.59,0.3
dCqWBBJfDfDsEkP8iNhyUf,PINK FLORAL FELTCRAFT SHOULDER BAG,20970,3.75,2.78,2.81,0.25
i2a6EBvWXbaqx2rYLAcaCm,WHITE STITCHED CUSHION COVER,84658,6.95,5.97,6.53,0.06
kBwBPHidMwP7mViv2C9vqj,PIN CUSHION BABUSHKA RED,22448,3.35,1.41,1.78,0.47
A3Hi6GCwNSvikMfFc6egzi,PIN CUSHION BABUSHKA BLUE,22447,3.35,1.01,2.04,0.39
mMVknLxTGa9XofEVTJEMPQ,PIN CUSHION BABUSHKA PINK,22446,3.35,0.32,0.77,0.77
eaFio2WLU2ua9Cmon9trj2,RED RETROSPOT PURSE,20665,2.95,2.55,2.74,0.07
QEWXz4P9LX2Cur4wcK9Pp5,LADYBIRD + BEE RAFFIA FOOD COVER,21472,3.75,1.04,3.11,0.17
nyifNaWLtc6XqNQyfUdsVv,HOME SWEET HOME MUG,21877,1.25,1.25,1.25,0.0
DHYxrkgbybkPKZ7DVpEzeM,CHILDRENS GARDEN GLOVES BLUE,22524,1.25,1.08,1.11,0.11
mim8LhHynmJtF53n9iassj,CHRYSANTHEMUM SKETCHBOOK,20765,3.75,1.23,2.21,0.41
VmTevJQX2ovkejaCYQmc3f,VINTAGE UNION JACK DOORSTOP,21624,5.95,2.26,3.03,0.49
5XHjvdYu8b45ZZBcwg2VXx,WAKE UP COCKEREL TILE COASTER,84926A,1.25,0.55,0.73,0.42
GoEUvQf7Q7rN6qPTwqZo2r,ROSE 3 WICK MORRIS BOX CANDLE,85035C,4.25,1.64,3.1,0.27
bgBdY6m3J8E9S64Z2LZZaE,ROSE SCENT CANDLE JEWELLED DRAWER,72803A,4.25,2.36,3.78,0.11
efzMYDBCxtBRLJyJQqH24C,WHITE BAMBOO RIBS LAMPSHADE,40001,0.85,0.85,0.84,0.01
NaHZ4enRnvXXdu2gmtjTsx,FOLDING UMBRELLA CHOCOLATE POLKADOT,21709,4.95,4.32,4.5,0.09
CgncmoycqnrNUjMSFjRjCY,CAKE STAND LOVEBIRD 2 TIER WHITE,22220,9.95,9.77,9.75,0.02
2StiX3mtfeqPiSqkG5SWpN,3 GARDENIA MORRIS BOXED CANDLES,85034A,4.25,3.24,3.65,0.14
ECpgsF4zWYhZ7gKyrZJDad,SET/4 GARDEN ROSE DINNER CANDLE,72798C,1.65,0.76,0.97,0.41
bjVhWHPw4QqXVSeeBEj3Yv,GOLD PRINT PAPER BAG,35271S,0.19,0.13,0.15,0.19
jdsMgboBWLC4ib8TUgR9ZF,WOODEN HAPPY BIRTHDAY GARLAND,21380,2.95,0.91,2.66,0.1
EDsEADY6mLDCGaK8AZfm2H,SET/4 BADGES CUTE CREATURES,21221,1.25,1.12,1.14,0.09
8brbWB2EXzXxnhtpDgHJ6W,BLUE PAISLEY POCKET BOOK,20755,0.85,0.71,0.79,0.07
8omfmR8oQu3sGcLab9qdef,PORCELAIN ROSE LARGE,21421,1.25,0.38,0.91,0.27
2JtHvEJZYZznUp9dBcFdWd,PORCELAIN ROSE SMALL,21422,0.85,0.26,0.59,0.3
iiQpeGdCuywXsz9ekVKujj,BAKING SET SPACEBOY DESIGN,22617,4.25,3.66,3.74,0.12
9mXJrJk6Nfq85VuC4MRiKs,PEACE SMALL WOOD LETTERS,21364,6.75,0.79,2.36,0.65
2JvGvUrPMYbVy5SJKC3MQZ,RED RETROSPOT APRON,21042,5.95,4.72,5.06,0.15
KEnLownhhTFu3Dm5gVf7UG,FELTCRAFT DOLL MARIA,22272,2.95,0.58,2.09,0.29
Vf2z3mEkUGncuGcZoshqdb,PARTY METAL SIGN,21172,1.45,0.03,1.03,0.29
Vwg8ZofuLsjoZDATur4Vmq,VINTAGE CREAM 3 BASKET CAKE STAND,72760B,9.95,5.71,8.16,0.18
izLBsnEykPSzPxGYyBLqaM,DOORMAT RESPECTABLE HOUSE,22365,7.95,7.17,7.16,0.1
AYRHviPiTQtxMS5LZSF4Vx,MEMO BOARD RETROSPOT  DESIGN,22507,4.95,2.3,2.67,0.46
